,Tweet,sentimen,clean_link,hapus_punc,substitute_slang,stemming,eliminate_stop_with_stemming,eliminate_stop_without_stemming
386,rt @robertindo1: beda konsep pembangunan jakarta #ahokdjarot vs ahy. #pilkadadki2017 #debat2pilkadadki @partaisocmed @temanahok\u2026 ,1, beda konsep pembangunan jakarta #ahokdjarot vs ahy. #pilkadadki2017 #debat2pilkadadki   , beda konsep pembangunan jakarta ahokdjarot vs ahy pilkadadki debatpilkadadki   ,beda konsep pembangunan jakarta ahokdjarot vs ahy pilkadadki debatpilkadadki,beda konsep bangun jakarta ahokdjarot vs ahy pilkadadki debatpilkadadki,beda konsep bangun jakarta ahokdjarot vs ahy pilkadadki debatpilkadadki,beda konsep pembangunan jakarta ahokdjarot vs ahy pilkadadki debatpilkadadki
387,@kompastv #debat2pilkadadki ahok jarot krn sdh terbukti sementara paslon 1 dan 3 hanya retorika dan masih dlm angan2.,1, #debat2pilkadadki ahok jarot krn sdh terbukti sementara paslon 1 dan 3 hanya retorika dan masih dlm angan2., debatpilkadadki ahok jarot krn sdh terbukti sementara paslon  dan  hanya retorika dan masih dlm angan,debatpilkadadki ahok jarot karena sudah terbukti sementara paslon dan hanya retorika dan masih dalam angan,debatpilkadadki ahok jarot karena sudah bukti sementara paslon dan hanya retorika dan masih dalam angan,debatpilkadadki ahok jarot bukti paslon retorika angan,debatpilkadadki ahok jarot terbukti paslon retorika angan
388,"rt @aniesbaswedan: ibu, terima kasih atas doa dan kumpulan pelajaran yang telah membangun pemikiran, karakter dan semangat untuk berju\u2026 ",1," ibu, terima kasih atas doa dan kumpulan pelajaran yang telah membangun pemikiran, karakter dan semangat untuk berju\u2026 ", ibu terima kasih atas doa dan kumpulan pelajaran yang telah membangun pemikiran karakter dan semangat untuk berjuu ,ibu terima kasih atas doa dan kumpulan pelajaran yang telah membangun pemikiran karakter dan semangat untuk berjuu,ibu terima kasih atas doa dan kumpul ajar yang telah bangun pikir karakter dan semangat untuk berjuu,terima kasih doa kumpul ajar bangun pikir karakter semangat berjuu,terima kasih doa kumpulan pelajaran membangun pemikiran karakter semangat berjuu
389,rt @handininanda: eh ini nyinyir dulu ya.. itu paslon 3 punya program ga sih?? daritadi kerjaannya korek2 aib orang doang. #gemetz #debat2p\u2026,0, eh ini nyinyir dulu ya.. itu paslon 3 punya program ga sih?? daritadi kerjaannya korek2 aib orang doang. #gemetz #debat2p\u2026, eh ini nyinyir dulu ya itu paslon  punya program ga sih daritadi kerjaannya korek aib orang doang gemetz debatpu,eh ini nyinyir dulu ya itu paslon punya program tidak sih daritadi kerjaannya korek aib orang doang gemetz debatpu,eh ini nyinyir dulu ya itu paslon punya program tidak sih daritadi kerja korek aib orang doang gemetz debatpu,eh nyinyir ya paslon program sih daritadi kerja korek aib orang doang gemetz debatpu,eh nyinyir ya paslon program sih daritadi kerjaannya korek aib orang doang gemetz debatpu
390,"pilkada dki jakarta harap tidak pilih nomor 2, bahaya laten komunis!... https:\/\/t.co\/7pcciaixnf #debat2pilkadadki https:\/\/t.co\/yajxsgq30c",0,"pilkada dki jakarta harap tidak pilih nomor 2, bahaya laten komunis!...  #debat2pilkadadki ",pilkada dki jakarta harap tidak pilih nomor  bahaya laten komunis  debatpilkadadki ,pilkada dki jakarta harap tidak pilih nomor bahaya laten komunis debatpilkadadki,pilkada dki jakarta harap tidak pilih nomor bahaya laten komunis debatpilkadadki,pilkada dki jakarta harap pilih nomor bahaya laten komunis debatpilkadadki,pilkada dki jakarta harap pilih nomor bahaya laten komunis debatpilkadadki
391,rt @teddygusnaidi: 27. kalau gunakan fantasi agus maka agus bisa menuding bahwa sby tidak beres memimpin. 10 tahun masih banyak yang miskin\u2026,0, 27. kalau gunakan fantasi agus maka agus bisa menuding bahwa sby tidak beres memimpin. 10 tahun masih banyak yang miskin\u2026,  kalau gunakan fantasi agus maka agus bisa menuding bahwa sby tidak beres memimpin  tahun masih banyak yang miskinu,kalau gunakan fantasi agus maka agus bisa menuding bahwa surabaya tidak beres memimpin tahun masih banyak yang miskinu,kalau guna fantasi agus maka agus bisa tuding bahwa surabaya tidak beres pimpin tahun masih banyak yang miskinu,fantasi agus agus tuding surabaya beres pimpin miskinu,fantasi agus agus menuding surabaya beres memimpin miskinu
392,"rt @rezathfc: ahok melerai sylvi dan anies, the best moment of #debat2pilkadadki",1," ahok melerai sylvi dan anies, the best moment of #debat2pilkadadki", ahok melerai sylvi dan anies the best moment of debatpilkadadki,ahok melerai sylvi dan anies the best moment of debatpilkadadki,ahok lerai sylvi dan anies the best moment of debatpilkadadki,ahok lerai sylvi anies the best moment of debatpilkadadki,ahok melerai sylvi anies the best moment of debatpilkadadki
393,"pokoknya hari ini harus #semuacoblosaniessandi, tapi tanggal 15feb #tetapahokdjarot #temanahok #debat2pilkadadki #ahokdjarothebat",1,"pokoknya hari ini harus #semuacoblosaniessandi, tapi tanggal 15feb #tetapahokdjarot #temanahok #debat2pilkadadki #ahokdjarothebat",pokoknya hari ini harus semuacoblosaniessandi tapi tanggal feb tetapahokdjarot temanahok debatpilkadadki ahokdjarothebat,pokoknya hari ini harus semuacoblosaniessandi tapi tanggal feb tetapahokdjarot temanahok debatpilkadadki ahokdjarothebat,pokok hari ini harus semuacoblosaniessandi tapi tanggal feb tetapahokdjarot temanahok debatpilkadadki ahokdjarothebat,pokok semuacoblosaniessandi tanggal feb tetapahokdjarot temanahok debatpilkadadki ahokdjarothebat,pokoknya semuacoblosaniessandi tanggal feb tetapahokdjarot temanahok debatpilkadadki ahokdjarothebat
394,"rt @batack_overkill: #debat2pilkadadki paslon 3 : kami akan begini begono, harusnya begini begono, rencana kami begini begono... tapi inyon\u2026",0," #debat2pilkadadki paslon 3 : kami akan begini begono, harusnya begini begono, rencana kami begini begono... tapi inyon\u2026", debatpilkadadki paslon   kami akan begini begono harusnya begini begono rencana kami begini begono tapi inyonu,debatpilkadadki paslon kami akan begini begono harusnya begini begono rencana kami begini begono tapi inyonu,debatpilkadadki paslon kami akan begini begono harus begini begono rencana kami begini begono tapi inyonu,debatpilkadadki paslon begono begono rencana begono inyonu,debatpilkadadki paslon begono begono rencana begono inyonu
395,antasari azhar datang #debat2pilkadadki @sbyudhoyono  tak datang,0,antasari azhar datang #debat2pilkadadki   tak datang,antasari azhar datang debatpilkadadki   tak datang,antasari azhar datang debatpilkadadki tak datang,antasari azhar datang debatpilkadadki tak datang,antasari azhar debatpilkadadki,antasari azhar debatpilkadadki
396,"rt @ichakeljombar: seorang dosen yang seharusnya dikagumi karena cerdas otaknya, tapi seketika runtuh karena hobinya menjatuhkan orang lain\u2026",0," seorang dosen yang seharusnya dikagumi karena cerdas otaknya, tapi seketika runtuh karena hobinya menjatuhkan orang lain\u2026", seorang dosen yang seharusnya dikagumi karena cerdas otaknya tapi seketika runtuh karena hobinya menjatuhkan orang lainu,seorang dosen yang seharusnya dikagumi karena cerdas otaknya tapi seketika runtuh karena hobinya menjatuhkan orang lainu,orang dosen yang harus kagum karena cerdas otak tapi ketika runtuh karena hobi jatuh orang lainu,orang dosen kagum cerdas otak runtuh hobi jatuh orang lainu,dosen dikagumi cerdas otaknya runtuh hobinya menjatuhkan orang lainu
397,"rt @jurnintelijen: gestur anies terlihat sinis, dan sandi terlalu fokus soal kewirausahaan, kebanyakan hanya bicara \""akan\"" dlm #debat2pilka\u2026",0," gestur anies terlihat sinis, dan sandi terlalu fokus soal kewirausahaan, kebanyakan hanya bicara \""akan\"" dlm #debat2pilka\u2026", gestur anies terlihat sinis dan sandi terlalu fokus soal kewirausahaan kebanyakan hanya bicara akan dlm debatpilkau,gestur anies terlihat sinis dan sandi terlalu fokus soal kewirausahaan kebanyakan hanya bicara akan dalam debatpilkau,gestur anies lihat sinis dan sandi terlalu fokus soal kewirausahaan banyak hanya bicara akan dalam debatpilkau,gestur anies lihat sinis sandi fokus kewirausahaan bicara debatpilkau,gestur anies sinis sandi fokus kewirausahaan kebanyakan bicara debatpilkau
398,rt @putrirochaena: kapolri minta masyarakat lihat video pidato ahok secara utuh https:\/\/t.co\/gd8iipxqh7 lewat @tribunnews,1, kapolri minta masyarakat lihat video pidato ahok secara utuh  lewat , kapolri minta masyarakat lihat video pidato ahok secara utuh  lewat ,kapolri meminta masyarakat lihat video pidato ahok secara utuh lewat,kapolri minta masyarakat lihat video pidato ahok cara utuh lewat,kapolri masyarakat lihat video pidato ahok utuh,kapolri masyarakat lihat video pidato ahok utuh
399,ketua mui minta ahok perjelas permintaan maafnya https:\/\/t.co\/nnqsv7jw6g,1,ketua mui minta ahok perjelas permintaan maafnya ,ketua mui minta ahok perjelas permintaan maafnya ,ketua mui meminta ahok perjelas permintaan maafnya,ketua mui minta ahok jelas minta maaf,ketua mui ahok maaf,ketua mui ahok perjelas permintaan maafnya
400,"rt @gk4c4: melihat #debat2pilkadadki kemarin, jelas bahwa yg terjadi adalah perlawanan thd perubahan2 @jokowi @basuki_btp unt kembali ke ma\u2026",0," melihat #debat2pilkadadki kemarin, jelas bahwa yg terjadi adalah perlawanan thd perubahan2   unt kembali ke ma\u2026", melihat debatpilkadadki kemarin jelas bahwa yg terjadi adalah perlawanan thd perubahan   unt kembali ke mau,melihat debatpilkadadki kemarin jelas bahwa yang terjadi adalah perlawanan thd perubahan unt kembali ke mau,lihat debatpilkadadki kemarin jelas bahwa yang jadi adalah lawan thd ubah unt kembali ke mau,lihat debatpilkadadki kemarin lawan thd ubah unt,debatpilkadadki kemarin perlawanan thd perubahan unt
401,"pilkada dki jakarta harap tidak pilih nomor 2, bahaya laten komunis!... https:\/\/t.co\/x1exozckpe #debat2pilkadadki https:\/\/t.co\/chuksjrntz",0,"pilkada dki jakarta harap tidak pilih nomor 2, bahaya laten komunis!...  #debat2pilkadadki ",pilkada dki jakarta harap tidak pilih nomor  bahaya laten komunis  debatpilkadadki ,pilkada dki jakarta harap tidak pilih nomor bahaya laten komunis debatpilkadadki,pilkada dki jakarta harap tidak pilih nomor bahaya laten komunis debatpilkadadki,pilkada dki jakarta harap pilih nomor bahaya laten komunis debatpilkadadki,pilkada dki jakarta harap pilih nomor bahaya laten komunis debatpilkadadki
402,"masalah berawal dari kasus penistaan agama,\npenyelesaiannya jadi sumber masalah baru berwujud kriminalisasi &amp",0,"masalah berawal dari kasus penistaan agama,\npenyelesaiannya jadi sumber masalah baru berwujud kriminalisasi &amp",masalah berawal dari kasus penistaan agamanpenyelesaiannya jadi sumber masalah baru berwujud kriminalisasi amp,masalah berawal dari kasus penistaan agamanpenyelesaiannya jadi sumber masalah baru berwujud kriminalisasi amp,masalah awal dari kasus nista agamanpenyelesaiannya jadi sumber masalah baru wujud kriminalisasi amp,nista agamanpenyelesaiannya sumber wujud kriminalisasi amp,penistaan agamanpenyelesaiannya sumber berwujud kriminalisasi amp
403,bener - bener kelar dki kalo emak yang pic 3 jadi.. https:\/\/t.co\/x7ysjshu89,0,bener - bener kelar dki kalo emak yang pic 3 jadi.. ,bener  bener kelar dki kalo emak yang pic  jadi ,benar benar kelar dki kalo emak yang pic jadi,benar benar kelar dki kalo emak yang pic jadi,kelar dki kalo emak pic,kelar dki kalo emak pic
404,"rt @yogadk: cadasss!!  mas agus keren nih! live mata najwa, daripada gubernur kontroversi muluk \ud83d\ude04",1," cadasss!!  mas agus keren nih! live mata najwa, daripada gubernur kontroversi muluk \ud83d\ude04", cadasss  mas agus keren nih live mata najwa daripada gubernur kontroversi muluk uddude,cadass mas agus keren nih live mata najwa daripada gubernur kontroversi muluk uddude,cadass mas agus keren nih live mata najwa daripada gubernur kontroversi muluk uddude,cadass mas agus keren nih live mata najwa gubernur kontroversi muluk uddude,cadass mas agus keren nih live mata najwa gubernur kontroversi muluk uddude
405,"rt @agusfansclub_: mas agus menanggapi pertanyaan mslh dinasti,dikatakan bhw dinasti itu konotasinya negatif &amp",1," mas agus menanggapi pertanyaan mslh dinasti,dikatakan bhw dinasti itu konotasinya negatif &amp", mas agus menanggapi pertanyaan mslh dinastidikatakan bhw dinasti itu konotasinya negatif amp,mas agus menanggapi pertanyaan masalah dinastidikatakan bahwa dinasti itu konotasinya negatif amp,mas agus tanggap tanya masalah dinastidikatakan bahwa dinasti itu konotasi negatif amp,mas agus tanggap dinastidikatakan dinasti konotasi negatif amp,mas agus menanggapi dinastidikatakan dinasti konotasinya negatif amp
406,"@matanajwa mukaya agus merah bangettt, cari dukungan penonton pula untuk dukung jwbannya wkwkw",1," mukaya agus merah bangettt, cari dukungan penonton pula untuk dukung jwbannya wkwkw", mukaya agus merah bangettt cari dukungan penonton pula untuk dukung jwbannya wkwkw,mukaya agus merah banget cari dukungan penonton pula untuk dukung jwbannya wkwkw,mukaya agus merah banget cari dukung tonton pula untuk dukung jwbannya wkwkw,mukaya agus merah banget cari dukung tonton dukung jwbannya wkwkw,mukaya agus merah banget cari dukungan penonton dukung jwbannya wkwkw
407,"mas agus yudhoyono tetap yang terbaik,semoga sukses di pilkada dki 2017",1,"mas agus yudhoyono tetap yang terbaik,semoga sukses di pilkada dki 2017",mas agus yudhoyono tetap yang terbaiksemoga sukses di pilkada dki ,mas agus yudhoyono tetap yang terbaiksemoga sukses di pilkada dki,mas agus yudhoyono tetap yang terbaiksemoga sukses di pilkada dki,mas agus yudhoyono terbaiksemoga sukses pilkada dki,mas agus yudhoyono terbaiksemoga sukses pilkada dki
408,1. baiklah (mau komentar apa juga bingung).\n#debat2pilkadadki,0,1. baiklah (mau komentar apa juga bingung).\n#debat2pilkadadki, baiklah mau komentar apa juga bingungndebatpilkadadki,baiklah mau komentar apa juga bingungndebatpilkadadki,baik mau komentar apa juga bingungndebatpilkadadki,komentar bingungndebatpilkadadki,baiklah komentar bingungndebatpilkadadki
409,rt @sehan5: pk anis nyinggung kjp. rakyat jkt perlu tau nih. justru pk anis itu di copot oleh pk jkw krn ngurus kip gk berhasil. #debat2pil\u2026,0, pk anis nyinggung kjp. rakyat jkt perlu tau nih. justru pk anis itu di copot oleh pk jkw krn ngurus kip gk berhasil. #debat2pil\u2026, pk anis nyinggung kjp rakyat jkt perlu tau nih justru pk anis itu di copot oleh pk jkw krn ngurus kip gk berhasil debatpilu,pakai anis nyinggung kjp rakyat jakarta perlu tahu nih justru pakai anis itu di copot oleh pakai jkw karena mengurus kip tidak berhasil debatpilu,pakai anis nyinggung kjp rakyat jakarta perlu tahu nih justru pakai anis itu di copot oleh pakai jkw karena urus kip tidak hasil debatpilu,pakai anis nyinggung kjp rakyat jakarta nih pakai anis copot pakai jkw urus kip hasil debatpilu,pakai anis nyinggung kjp rakyat jakarta nih pakai anis copot pakai jkw mengurus kip berhasil debatpilu
410,paslon 1 \nmiliter loncat k gubernur\n\npaslon 2 \nbupati naik wagub naik gbernur\n\npaslon 3 :\ndosen jd mentri dcopot&amp,0,paslon 1 \nmiliter loncat k gubernur\n\npaslon 2 \nbupati naik wagub naik gbernur\n\npaslon 3 :\ndosen jd mentri dcopot&amp,paslon  nmiliter loncat k gubernurnnpaslon  nbupati naik wagub naik gbernurnnpaslon  ndosen jd mentri dcopotamp,paslon nmiliter loncat kak gubernurnnpaslon nbupati naik wagub naik gbernurnnpaslon ndosen jadi mentri dcopotamp,paslon nmiliter loncat kak gubernurnnpaslon nbupati naik wagub naik gbernurnnpaslon ndosen jadi tri dcopotamp,paslon nmiliter loncat kak gubernurnnpaslon nbupati wagub gbernurnnpaslon ndosen tri dcopotamp,paslon nmiliter loncat kak gubernurnnpaslon nbupati wagub gbernurnnpaslon ndosen mentri dcopotamp
411,agus itu memang cerdas n jadi gugup najwa  #ahymatanajwa,1,agus itu memang cerdas n jadi gugup najwa  #ahymatanajwa,agus itu memang cerdas n jadi gugup najwa  ahymatanajwa,agus itu memang cerdas n jadi gugup najwa ahymatanajwa,agus itu memang cerdas n jadi gugup najwa ahymatanajwa,agus cerdas n gugup najwa ahymatanajwa,agus cerdas n gugup najwa ahymatanajwa
412,"membangun tanpa menyakiti\nanies-sandi cerdas ,santun &amp",1,"membangun tanpa menyakiti\nanies-sandi cerdas ,santun &amp",membangun tanpa menyakitinaniessandi cerdas santun amp,membangun tanpa menyakitinaniessandi cerdas santun amp,bangun tanpa menyakitinaniessandi cerdas santun amp,bangun menyakitinaniessandi cerdas santun amp,membangun menyakitinaniessandi cerdas santun amp
413,"rt @ilc_tvonenews: \""ahok sudah meminta maaf, artinya dia mengakui dirinya bersalah. tinggal proses hukum dijalankan\"" fadli zon #ilcahokmint\u2026",1," \""ahok sudah meminta maaf, artinya dia mengakui dirinya bersalah. tinggal proses hukum dijalankan\"" fadli zon #ilcahokmint\u2026", ahok sudah meminta maaf artinya dia mengakui dirinya bersalah tinggal proses hukum dijalankan fadli zon ilcahokmintu,ahok sudah meminta maaf artinya dia mengakui dirinya bersalah tinggal proses hukum dijalankan fadli zon ilcahokmintu,ahok sudah minta maaf arti dia aku diri salah tinggal proses hukum jalan fadli zon ilcahokmintu,ahok maaf arti salah tinggal proses hukum jalan fadli zon ilcahokmintu,ahok maaf mengakui bersalah tinggal proses hukum dijalankan fadli zon ilcahokmintu
414,#debat2pilkadadki - cakep berentiin reklamasi agar kita dpt pantai pass di depan rumah kita pass lagi musim hujan !! hadew,0,#debat2pilkadadki - cakep berentiin reklamasi agar kita dpt pantai pass di depan rumah kita pass lagi musim hujan !! hadew,debatpilkadadki  cakep berentiin reklamasi agar kita dpt pantai pass di depan rumah kita pass lagi musim hujan  hadew,debatpilkadadki cakep berentiin reklamasi agar kita dapat pantai pas di depan rumah kita pas lagi musim hujan hadew,debatpilkadadki cakep berentiin reklamasi agar kita dapat pantai pas di depan rumah kita pas lagi musim hujan hadew,debatpilkadadki cakep berentiin reklamasi pantai pas rumah pas musim hujan hadew,debatpilkadadki cakep berentiin reklamasi pantai pas rumah pas musim hujan hadew
415,"rt @raztheda: paslon 3 once said: jangan memilih pemimpin yang justru memecah belah. tonight i realised,he should keep it for himself \ud83d\ude0c #de\u2026",0," paslon 3 once said: jangan memilih pemimpin yang justru memecah belah. tonight i realised,he should keep it for himself \ud83d\ude0c #de\u2026", paslon  once said jangan memilih pemimpin yang justru memecah belah tonight i realisedhe should keep it for himself uddudec deu,paslon once said jangan memilih pemimpin yang justru memecah belah tonight i realisedhe should keep itu for himself uddudec deu,paslon once said jangan pilih pimpin yang justru pecah belah tonight i realisedhe should keep itu for himself uddudec deu,paslon once said pilih pimpin pecah belah tonight i realisedhe should keep for himself uddudec deu,paslon once said memilih pemimpin memecah belah tonight i realisedhe should keep for himself uddudec deu
416,"rt @putrirosary: #debat2pilkadadki cara paslon 3 bertanya ke paslon 1 seperti sedang mengadu domba didepan jutaan pasang mata tanpa etika,\u2026",0," #debat2pilkadadki cara paslon 3 bertanya ke paslon 1 seperti sedang mengadu domba didepan jutaan pasang mata tanpa etika,\u2026", debatpilkadadki cara paslon  bertanya ke paslon  seperti sedang mengadu domba didepan jutaan pasang mata tanpa etikau,debatpilkadadki cara paslon bertanya ke paslon seperti sedang mengadu domba didepan jutaan pasang mata tanpa etikau,debatpilkadadki cara paslon tanya ke paslon seperti sedang adu domba depan juta pasang mata tanpa etikau,debatpilkadadki paslon paslon adu domba juta pasang mata etikau,debatpilkadadki paslon paslon mengadu domba didepan jutaan pasang mata etikau
417,malaysiakini ahok mohon maaf pertikai al quran ketika berkempen: bahagian siasatan jenayah polis mener... https:\/\/t.co\/anhu2ay6pw #prkdr,1,malaysiakini ahok mohon maaf pertikai al quran ketika berkempen: bahagian siasatan jenayah polis mener...  #prkdr,malaysiakini ahok mohon maaf pertikai al quran ketika berkempen bahagian siasatan jenayah polis mener  prkdr,malaysiakini ahok mohon maaf pertikai al quran ketika berkempen bahagian siasatan jenayah polis mener prkdr,malaysiakini ahok mohon maaf tikai al quran ketika berkempen bahagian siasat jenayah polis ter prkdr,malaysiakini ahok mohon maaf tikai al quran berkempen bahagian siasat jenayah polis ter prkdr,malaysiakini ahok mohon maaf pertikai al quran berkempen bahagian siasatan jenayah polis mener prkdr
418,lensaindonesia: muhaimin iskandar: permintaan maaf ahok sangat kita hargai https:\/\/t.co\/xocrzt0isy via lensaindonesia,1,lensaindonesia: muhaimin iskandar: permintaan maaf ahok sangat kita hargai  via lensaindonesia,lensaindonesia muhaimin iskandar permintaan maaf ahok sangat kita hargai  via lensaindonesia,lensaindonesia muhaimin iskandar permintaan maaf ahok sangat kita hargai via lensaindonesia,lensaindonesia muhaimin iskandar minta maaf ahok sangat kita harga via lensaindonesia,lensaindonesia muhaimin iskandar maaf ahok harga via lensaindonesia,lensaindonesia muhaimin iskandar permintaan maaf ahok hargai via lensaindonesia
419,"rt @agusfansclub_: tahun 2013,saat live dg @matanajwa ,mas agus sama sekali tidak terpikir untuk terjun ke dunia politik #ahymatanajwa",1," tahun 2013,saat live dg  ,mas agus sama sekali tidak terpikir untuk terjun ke dunia politik #ahymatanajwa", tahun saat live dg  mas agus sama sekali tidak terpikir untuk terjun ke dunia politik ahymatanajwa,tahun saat live dengan mas agus sama sekali tidak terpikir untuk terjun ke dunia politik ahymatanajwa,tahun saat live dengan mas agus sama sekali tidak pikir untuk terjun ke dunia politik ahymatanajwa,live mas agus pikir terjun dunia politik ahymatanajwa,live mas agus terpikir terjun dunia politik ahymatanajwa
420,langsung ke pancing mas agus? militer keluar :p\n#ahymatanajwa,1,langsung ke pancing mas agus? militer keluar :p\n#ahymatanajwa,langsung ke pancing mas agus militer keluar pnahymatanajwa,langsung ke pancing mas agus militer keluar pnahymatanajwa,langsung ke pancing mas agus militer keluar pnahymatanajwa,langsung pancing mas agus militer pnahymatanajwa,langsung pancing mas agus militer pnahymatanajwa
421,rt @arieskradianto: jadi pertanyaan-nya apa???  #debat2pilkadadki #awasituhoax https:\/\/t.co\/qblrkhiksa,0, jadi pertanyaan-nya apa???  #debat2pilkadadki #awasituhoax , jadi pertanyaannya apa  debatpilkadadki awasituhoax ,jadi pertanyaannya apa debatpilkadadki awasituhoax,jadi tanya apa debatpilkadadki awasituhoax,debatpilkadadki awasituhoax,pertanyaannya debatpilkadadki awasituhoax
422,pdip sengaja becah belah rakyat warga dki tidak pilih ahok!! pertemu... https:\/\/t.co\/solwflvvvp #debat2pilkadadki https:\/\/t.co\/vae3bokccb,0,pdip sengaja becah belah rakyat warga dki tidak pilih ahok!! pertemu...  #debat2pilkadadki ,pdip sengaja becah belah rakyat warga dki tidak pilih ahok pertemu  debatpilkadadki ,pdip sengaja becah belah rakyat warga dki tidak pilih ahok pertemu debatpilkadadki,pdip sengaja becah belah rakyat warga dki tidak pilih ahok temu debatpilkadadki,pdip sengaja becah belah rakyat warga dki pilih ahok temu debatpilkadadki,pdip sengaja becah belah rakyat warga dki pilih ahok pertemu debatpilkadadki
423,rt @pbenyw: mpok @sylviana_murni salah sebut dg uu no 8 terkait pengelolaan sampah. padahal yg benar uu 18\/2008.\u2026 ,0, mpok  salah sebut dg uu no 8 terkait pengelolaan sampah. padahal yg benar uu 18\/2008.\u2026 , mpok  salah sebut dg uu no  terkait pengelolaan sampah padahal yg benar uu u ,mpok salah sebut dengan uu no terkait pengelolaan sampah padahal yang benar uu kamu,mpok salah sebut dengan uu no kait kelola sampah padahal yang benar uu kamu,mpok salah uu no kait kelola sampah uu,mpok salah uu no terkait pengelolaan sampah uu
424,pilkada dki jangan pilih pki!! berbahaya!! pilih 1 atau 3 saja soal pengganti patrialis... https:\/\/t.co\/vnp7rzoann #debat2pilkadadki #imlek,0,pilkada dki jangan pilih pki!! berbahaya!! pilih 1 atau 3 saja soal pengganti patrialis...  #debat2pilkadadki #imlek,pilkada dki jangan pilih pki berbahaya pilih  atau  saja soal pengganti patrialis  debatpilkadadki imlek,pilkada dki jangan pilih pki berbahaya pilih atau saja soal pengganti patrialis debatpilkadadki imlek,pilkada dki jangan pilih pki bahaya pilih atau saja soal ganti patrialis debatpilkadadki imlek,pilkada dki pilih pki bahaya pilih ganti patrialis debatpilkadadki imlek,pilkada dki pilih pki berbahaya pilih pengganti patrialis debatpilkadadki imlek
425,"rt @imadya: perhatikan tiap sandi jawab seluruh pertanyaan, pasti ujung2nya nyambung ke lapangan pekerjaan. hanya menguasai itu saja #debat\u2026",1," perhatikan tiap sandi jawab seluruh pertanyaan, pasti ujung2nya nyambung ke lapangan pekerjaan. hanya menguasai itu saja #debat\u2026", perhatikan tiap sandi jawab seluruh pertanyaan pasti ujungnya nyambung ke lapangan pekerjaan hanya menguasai itu saja debatu,perhatikan tiap sandi jawab seluruh pertanyaan pasti ujungnya menyambung ke lapangan pekerjaan hanya menguasai itu saja debatu,perhati tiap sandi jawab seluruh tanya pasti ujung sambung ke lapang kerja hanya kuasa itu saja debatu,perhati sandi ujung sambung lapang kerja kuasa debatu,perhatikan sandi ujungnya menyambung lapangan pekerjaan menguasai debatu
