,Tweet,sentimen,clean_link,hapus_punc,substitute_slang,stemming,eliminate_stop_with_stemming,eliminate_stop_without_stemming
1118,"rt @ulinyusron: membandingkan cara ahok, anies, agus selesaikan banjir jakarta *hanya ahok yang programnya jelas, lainnya abstrak* https:\/\/\u2026",0," membandingkan cara ahok, anies, agus selesaikan banjir jakarta *hanya ahok yang programnya jelas, lainnya abstrak* ", membandingkan cara ahok anies agus selesaikan banjir jakarta hanya ahok yang programnya jelas lainnya abstrak ,membandingkan cara ahok anies agus selesaikan banjir jakarta hanya ahok yang programnya jelas lainnya abstrak,banding cara ahok anies agus selesai banjir jakarta hanya ahok yang program jelas lain abstrak,banding ahok anies agus selesai banjir jakarta ahok program abstrak,membandingkan ahok anies agus selesaikan banjir jakarta ahok programnya abstrak
1119,agus yudhoyono tegas dan lugas jawab pertanyaan. yg nanya aja kyak wanita gx berpendidikan.,0,agus yudhoyono tegas dan lugas jawab pertanyaan. yg nanya aja kyak wanita gx berpendidikan.,agus yudhoyono tegas dan lugas jawab pertanyaan yg nanya aja kyak wanita gx berpendidikan,agus yudhoyono tegas dan lugas jawab pertanyaan yang tanya saja kayak wanita tidak berpendidikan,agus yudhoyono tegas dan lugas jawab tanya yang tanya saja kayak wanita tidak didik,agus yudhoyono lugas kayak wanita didik,agus yudhoyono lugas kayak wanita berpendidikan
1120,rt @dennyja_world: saya melihat data lsi soal pilkada dki yang mengejutkan (survei okt 2016): ahok potensial kalah!,0, saya melihat data lsi soal pilkada dki yang mengejutkan (survei okt 2016): ahok potensial kalah!, saya melihat data lsi soal pilkada dki yang mengejutkan survei okt  ahok potensial kalah,saya melihat data lsi soal pilkada dki yang mengejutkan survei okt ahok potensial kalah,saya lihat data lsi soal pilkada dki yang kejut survei okt ahok potensial kalah,lihat data lsi pilkada dki kejut survei okt ahok potensial kalah,data lsi pilkada dki mengejutkan survei okt ahok potensial kalah
1121,"rt @stone_cobain: loh!? kalau setiap saya mengatakan kebenaran dianggap ahokers, artinya ahok benar dong.. \u2615 https:\/\/t.co\/cqoilx9mgl",0," loh!? kalau setiap saya mengatakan kebenaran dianggap ahokers, artinya ahok benar dong.. \u2615 ", loh kalau setiap saya mengatakan kebenaran dianggap ahokers artinya ahok benar dong u ,loh kalau setiap saya mengatakan kebenaran dianggap ahokers artinya ahok benar dong kamu,loh kalau tiap saya kata benar anggap ahokers arti ahok benar dong kamu,loh anggap ahokers arti ahok,loh kebenaran dianggap ahokers ahok
1122,smg kang sahal allah satukan bersama ahok d hari akhir nanti. https:\/\/t.co\/dqpdou8ezh,0,smg kang sahal allah satukan bersama ahok d hari akhir nanti. ,smg kang sahal allah satukan bersama ahok d hari akhir nanti ,semoga kang sahal allah satukan bersama ahok ada hari akhir nanti,moga kang sahal allah satu sama ahok ada hari akhir nanti,moga kang sahal allah ahok,semoga kang sahal allah satukan ahok
1123,"@matanajwa, agus, orngnya ternyata emosional, ga bisa didikte.. huff",0," agus, orngnya ternyata emosional, ga bisa didikte.. huff", agus orngnya ternyata emosional ga bisa didikte huff,agus orngnya ternyata emosional tidak bisa didikte huff,agus orngnya nyata emosional tidak bisa dikte huff,agus orngnya nyata emosional dikte huff,agus orngnya emosional didikte huff
1124,agus yudhoyono udah di skakmat 3x di segmen 1. hacep lah mata najwa \ud83d\udc4d\ud83d\ude02\ud83d\ude02\ud83d\ude02,0,agus yudhoyono udah di skakmat 3x di segmen 1. hacep lah mata najwa \ud83d\udc4d\ud83d\ude02\ud83d\ude02\ud83d\ude02,agus yudhoyono udah di skakmat x di segmen  hacep lah mata najwa uddudcduddudeuddudeuddude,agus yudhoyono sudah di skakmat kali di segmen hacep lah mata najwa uddudcduddudeuddudeuddude,agus yudhoyono sudah di skakmat kali di segmen hacep lah mata najwa uddudcduddudeuddudeuddude,agus yudhoyono skakmat kali segmen hacep mata najwa uddudcduddudeuddudeuddude,agus yudhoyono skakmat kali segmen hacep mata najwa uddudcduddudeuddudeuddude
1125,"rt @agusfansclub_: tahun 2013,saat live dg @matanajwa ,mas agus sama sekali tidak terpikir untuk terjun ke dunia politik #ahymatanajwa",1," tahun 2013,saat live dg  ,mas agus sama sekali tidak terpikir untuk terjun ke dunia politik #ahymatanajwa", tahun saat live dg  mas agus sama sekali tidak terpikir untuk terjun ke dunia politik ahymatanajwa,tahun saat live dengan mas agus sama sekali tidak terpikir untuk terjun ke dunia politik ahymatanajwa,tahun saat live dengan mas agus sama sekali tidak pikir untuk terjun ke dunia politik ahymatanajwa,live mas agus pikir terjun dunia politik ahymatanajwa,live mas agus terpikir terjun dunia politik ahymatanajwa
1126,rt @halojakarta: selamat menjalankan tugas mba @sophialatjuba88 sebagai juru bicara ahok djarot\n\n@basuki_btp https:\/\/t.co\/vlgwffugha,1, selamat menjalankan tugas mba  sebagai juru bicara ahok djarot\n\n , selamat menjalankan tugas mba  sebagai juru bicara ahok djarotnn ,selamat menjalankan tugas mbak sebagai juru bicara ahok djarotnn,selamat jalan tugas mbak bagai juru bicara ahok djarotnn,selamat jalan tugas mbak juru bicara ahok djarotnn,selamat menjalankan tugas mbak juru bicara ahok djarotnn
1127,"\/\/ soal quran, polisi harus cari saksi yang dengar langsung pernyataan ahok di pulau seribu https:\/\/t.co\/hyx1uhnoiz",1,"\/\/ soal quran, polisi harus cari saksi yang dengar langsung pernyataan ahok di pulau seribu ", soal quran polisi harus cari saksi yang dengar langsung pernyataan ahok di pulau seribu ,soal quran polisi harus cari saksi yang dengar langsung pernyataan ahok di pulau seribu,soal quran polisi harus cari saksi yang dengar langsung nyata ahok di pulau ribu,quran polisi cari saksi dengar langsung nyata ahok pulau ribu,quran polisi cari saksi dengar langsung pernyataan ahok pulau seribu
1128,"tafsir #ahok, ocehan nusron dll tu ga lagi dilihat sekedar debat pilkada tapi melebar ke bentur-politik, #benturbudaya (tulisan huntington).",0,"tafsir #ahok, ocehan nusron dll tu ga lagi dilihat sekedar debat pilkada tapi melebar ke bentur-politik, #benturbudaya (tulisan huntington).",tafsir ahok ocehan nusron dll tu ga lagi dilihat sekedar debat pilkada tapi melebar ke benturpolitik benturbudaya tulisan huntington,tafsir ahok ocehan nusron dll itu tidak lagi dilihat sekedar debat pilkada tapi melebar ke benturpolitik benturbudaya tulisan huntington,tafsir ahok oceh nusron dll itu tidak lagi lihat dar debat pilkada tapi lebar ke benturpolitik benturbudaya tulis huntington,tafsir ahok oceh nusron dll lihat dar debat pilkada lebar benturpolitik benturbudaya tulis huntington,tafsir ahok ocehan nusron dll sekedar debat pilkada melebar benturpolitik benturbudaya tulisan huntington
1129,rt @agusfansclub_: mas agus menganggap media adalah sahabat ahy #ahymatanajwa,0, mas agus menganggap media adalah sahabat ahy #ahymatanajwa, mas agus menganggap media adalah sahabat ahy ahymatanajwa,mas agus menganggap media adalah sahabat ahy ahymatanajwa,mas agus anggap media adalah sahabat ahy ahymatanajwa,mas agus anggap media sahabat ahy ahymatanajwa,mas agus menganggap media sahabat ahy ahymatanajwa
1130,"rt @toto_b2w: rasulullah saw tdk pernah mengajarkan umatnya melakukan perbuatan keji, ada apa dg ketua mui ini?!seolah sdg menjal\u2026 ",1," rasulullah saw tdk pernah mengajarkan umatnya melakukan perbuatan keji, ada apa dg ketua mui ini?!seolah sdg menjal\u2026 ", rasulullah saw tdk pernah mengajarkan umatnya melakukan perbuatan keji ada apa dg ketua mui iniseolah sdg menjalu ,rasulullah saw tidak pernah mengajarkan umatnya melakukan perbuatan keji ada apa dengan ketua mui iniseolah sedang menjalu,rasulullah saw tidak pernah ajar umat laku buat keji ada apa dengan ketua mui iniseolah sedang jalu,rasulullah saw ajar umat laku keji ketua mui iniseolah jalu,rasulullah saw mengajarkan umatnya perbuatan keji ketua mui iniseolah menjalu
1131,perlu karakter mirip ahok untuk bkasi lbh baikrt @ronni_hermawan_: ini beneran gak ya ?? saya di (cont) https:\/\/t.co\/utryvaypce,1,perlu karakter mirip ahok untuk bkasi lbh baikrt  ini beneran gak ya ?? saya di (cont) ,perlu karakter mirip ahok untuk bkasi lbh baikrt  ini beneran gak ya  saya di cont ,perlu karakter mirip ahok untuk bkasi lebih baikrt ini benaran tidak ya saya di cont,perlu karakter mirip ahok untuk bkasi lebih baikrt ini benar tidak ya saya di cont,karakter ahok bkasi baikrt ya cont,karakter ahok bkasi baikrt benaran ya cont
1132,"rt @panjimascom: polri tunda proses hukum ahok hingga selesai pilgub, ipw: kemarahan umat islam akan memuncak https:\/\/t.co\/0afqzzgsz1",1," polri tunda proses hukum ahok hingga selesai pilgub, ipw: kemarahan umat islam akan memuncak ", polri tunda proses hukum ahok hingga selesai pilgub ipw kemarahan umat islam akan memuncak ,polri tunda proses hukum ahok hingga selesai pilgub ipw kemarahan umat islam akan memuncak,polri tunda proses hukum ahok hingga selesai pilgub ipw marah umat islam akan puncak,polri tunda proses hukum ahok selesai pilgub ipw marah umat islam puncak,polri tunda proses hukum ahok selesai pilgub ipw kemarahan umat islam memuncak
1133,rachmawati tersinggung megawati ajak ahok ke makam bung karno https:\/\/t.co\/xyxkabkxcg (tribunpekanbaru),0,rachmawati tersinggung megawati ajak ahok ke makam bung karno  (tribunpekanbaru),rachmawati tersinggung megawati ajak ahok ke makam bung karno  tribunpekanbaru,rachmawati tersinggung megawati ajak ahok ke makam bung karno tribunpekanbaru,rachmawati singgung megawati ajak ahok ke makam bung karno tribunpekanbaru,rachmawati singgung megawati ajak ahok makam karno tribunpekanbaru,rachmawati tersinggung megawati ajak ahok makam karno tribunpekanbaru
1134,#tuitpekanbaru alasan anies sering turun ke masyarakat meski belum masa kampanye #pekanbaru #tuit,0,#tuitpekanbaru alasan anies sering turun ke masyarakat meski belum masa kampanye #pekanbaru #tuit,tuitpekanbaru alasan anies sering turun ke masyarakat meski belum masa kampanye pekanbaru tuit,tuitpekanbaru alasan anies sering turun ke masyarakat meski belum masa kampanye pekanbaru tuit,tuitpekanbaru alas anies sering turun ke masyarakat meski belum masa kampanye pekanbaru tuit,tuitpekanbaru alas anies turun masyarakat kampanye pekanbaru tuit,tuitpekanbaru alasan anies turun masyarakat kampanye pekanbaru tuit
1135,jk ahok minta maaf brarti ahok sdh mrs brsalah dg ucpanya.\ngmn dg yg membela n mebenarkn ucapan ahok? mrs brslh jg\u2026 https:\/\/t.co\/s7pda3r3am,0,jk ahok minta maaf brarti ahok sdh mrs brsalah dg ucpanya.\ngmn dg yg membela n mebenarkn ucapan ahok? mrs brslh jg\u2026 ,jk ahok minta maaf brarti ahok sdh mrs brsalah dg ucpanyangmn dg yg membela n mebenarkn ucapan ahok mrs brslh jgu ,jika ahok meminta maaf berarti ahok sudah mrs brsalah dengan ucpanyangmn dengan yang membela n mebenarkn ucapan ahok mrs brslh jgu,jika ahok minta maaf arti ahok sudah mrs brsalah dengan ucpanyangmn dengan yang bela n mebenarkn ucap ahok mrs brslh jgu,ahok maaf arti ahok mrs brsalah ucpanyangmn bela n mebenarkn ahok mrs brslh jgu,ahok maaf ahok mrs brsalah ucpanyangmn membela n mebenarkn ucapan ahok mrs brslh jgu
1136,"rt @agusfansclub_: mas agus menanggapi pertanyaan mslh dinasti,dikatakan bhw dinasti itu konotasinya negatif &amp",0," mas agus menanggapi pertanyaan mslh dinasti,dikatakan bhw dinasti itu konotasinya negatif &amp", mas agus menanggapi pertanyaan mslh dinastidikatakan bhw dinasti itu konotasinya negatif amp,mas agus menanggapi pertanyaan masalah dinastidikatakan bahwa dinasti itu konotasinya negatif amp,mas agus tanggap tanya masalah dinastidikatakan bahwa dinasti itu konotasi negatif amp,mas agus tanggap dinastidikatakan dinasti konotasi negatif amp,mas agus menanggapi dinastidikatakan dinasti konotasinya negatif amp
1137,rt @budimandjatmiko: 25 thn lalu saya aktif di gerakan. sdh ktm berjenis2 orang. ada petarung &amp,1, 25 thn lalu saya aktif di gerakan. sdh ktm berjenis2 orang. ada petarung &amp,  thn lalu saya aktif di gerakan sdh ktm berjenis orang ada petarung amp,tahun lalu saya aktif di gerakan sudah ktm berjenis orang ada petarung amp,tahun lalu saya aktif di gera sudah ktm jenis orang ada tarung amp,aktif gera ktm jenis orang tarung amp,aktif gerakan ktm berjenis orang petarung amp
1138,rt @panjimascom: tegakkan hukum dan keadilan terhadap ahok sebagai pelaku penghinaan al-qur\u2019an dan ulama https:\/\/t.co\/xihfnsrgjc,1, tegakkan hukum dan keadilan terhadap ahok sebagai pelaku penghinaan al-qur\u2019an dan ulama , tegakkan hukum dan keadilan terhadap ahok sebagai pelaku penghinaan alquruan dan ulama ,tegakkan hukum dan keadilan terhadap ahok sebagai pelaku penghinaan alquruan dan ulama,tegak hukum dan adil hadap ahok bagai laku hina alquruan dan ulama,tegak hukum adil hadap ahok laku hina alquruan ulama,tegakkan hukum keadilan ahok pelaku penghinaan alquruan ulama
1139,rt @beritasatu: ketua mui minta ahok perjelas permintaan maafnya https:\/\/t.co\/fvmasafoqk,1, ketua mui minta ahok perjelas permintaan maafnya , ketua mui minta ahok perjelas permintaan maafnya ,ketua mui meminta ahok perjelas permintaan maafnya,ketua mui minta ahok jelas minta maaf,ketua mui ahok maaf,ketua mui ahok perjelas permintaan maafnya
1140,"rt @cumarachel: betul, sayang opini yg dibentuk d sosmed seakan umat muslim haus balas dendam. citra islam jd rusak akibat penggiri\u2026 ",0," betul, sayang opini yg dibentuk d sosmed seakan umat muslim haus balas dendam. citra islam jd rusak akibat penggiri\u2026 ", betul sayang opini yg dibentuk d sosmed seakan umat muslim haus balas dendam citra islam jd rusak akibat penggiriu ,betul sayang opini yang dibentuk ada sosmed seakan umat muslim haus balas dendam citra islam jadi rusak akibat penggiriu,betul sayang opini yang bentuk ada sosmed akan umat muslim haus balas dendam citra islam jadi rusak akibat penggiriu,sayang opini bentuk sosmed umat muslim haus balas dendam citra islam rusak akibat penggiriu,sayang opini dibentuk sosmed seakan umat muslim haus balas dendam citra islam rusak akibat penggiriu
1141,"rt @panca66: pendukung ahok selalu bilang yang nga suka ahok islam pemarah, kecanduan agama dll. lha, nusron tadi ngomong kayak dewa mabok\u2026",0," pendukung ahok selalu bilang yang nga suka ahok islam pemarah, kecanduan agama dll. lha, nusron tadi ngomong kayak dewa mabok\u2026", pendukung ahok selalu bilang yang nga suka ahok islam pemarah kecanduan agama dll lha nusron tadi ngomong kayak dewa maboku,pendukung ahok selalu bilang yang enggak suka ahok islam pemarah kecanduan agama dll lah nusron tadi mengomong kayak dewa maboku,dukung ahok selalu bilang yang enggak suka ahok islam marah candu agama dll lah nusron tadi omong kayak dewa maboku,dukung ahok bilang suka ahok islam marah candu agama dll nusron omong kayak dewa maboku,pendukung ahok bilang suka ahok islam pemarah kecanduan agama dll nusron mengomong kayak dewa maboku
1142,rt @metro_tv: anda bisa mengikuti @matanajwa yang menghadirkan agus harimurti yudhoyono lwt live streaming di\u2026 ,1, anda bisa mengikuti  yang menghadirkan agus harimurti yudhoyono lwt live streaming di\u2026 , anda bisa mengikuti  yang menghadirkan agus harimurti yudhoyono lwt live streaming diu ,anda bisa mengikuti yang menghadirkan agus harimurti yudhoyono lewat live streaming diu,anda bisa ikut yang hadir agus harimurti yudhoyono lewat live streaming diu,hadir agus harimurti yudhoyono live streaming diu,mengikuti menghadirkan agus harimurti yudhoyono live streaming diu
1143,rt @halojakarta: selamat menjalankan tugas mba @sophialatjuba88 sebagai juru bicara ahok djarot\n\n@basuki_btp https:\/\/t.co\/vlgwffugha,1, selamat menjalankan tugas mba  sebagai juru bicara ahok djarot\n\n , selamat menjalankan tugas mba  sebagai juru bicara ahok djarotnn ,selamat menjalankan tugas mbak sebagai juru bicara ahok djarotnn,selamat jalan tugas mbak bagai juru bicara ahok djarotnn,selamat jalan tugas mbak juru bicara ahok djarotnn,selamat menjalankan tugas mbak juru bicara ahok djarotnn
1144,"rt @matanajwa: telah hadir di studio, agus harimurti yudhoyono, bakal calon gubernur dki jakarta yang diusung partai demokrat, ppp, pkb &amp",1," telah hadir di studio, agus harimurti yudhoyono, bakal calon gubernur dki jakarta yang diusung partai demokrat, ppp, pkb &amp", telah hadir di studio agus harimurti yudhoyono bakal calon gubernur dki jakarta yang diusung partai demokrat ppp pkb amp,telah hadir di studio agus harimurti yudhoyono bakal calon gubernur dki jakarta yang diusung partai demokrat pp pkb amp,telah hadir di studio agus harimurti yudhoyono bakal calon gubernur dki jakarta yang usung partai demokrat pp pkb amp,hadir studio agus harimurti yudhoyono calon gubernur dki jakarta usung partai demokrat pp pkb amp,hadir studio agus harimurti yudhoyono calon gubernur dki jakarta diusung partai demokrat pp pkb amp
1145,nyetel @metro_tv eh ada agus yudhoyono lagi di mata najwa...\nhmm... nonton ahhhh... keknya seru nih!,1,nyetel  eh ada agus yudhoyono lagi di mata najwa...\nhmm... nonton ahhhh... keknya seru nih!,nyetel  eh ada agus yudhoyono lagi di mata najwanhmm nonton ahhhh keknya seru nih,nyetel eh ada agus yudhoyono lagi di mata najwanhmm menonton ah kayaknya seru nih,nyetel eh ada agus yudhoyono lagi di mata najwanhmm tonton ah kayak seru nih,nyetel eh agus yudhoyono mata najwanhmm tonton ah kayak seru nih,nyetel eh agus yudhoyono mata najwanhmm menonton ah kayaknya seru nih
1146,"\/\/ wajar, rachmawati tersinggung megawati bawa ahok ke makam bung karno https:\/\/t.co\/j02plcafug",0,"\/\/ wajar, rachmawati tersinggung megawati bawa ahok ke makam bung karno ", wajar rachmawati tersinggung megawati bawa ahok ke makam bung karno ,wajar rachmawati tersinggung megawati bawa ahok ke makam bung karno,wajar rachmawati singgung megawati bawa ahok ke makam bung karno,wajar rachmawati singgung megawati bawa ahok makam karno,wajar rachmawati tersinggung megawati bawa ahok makam karno
1147,alasan anies sering turun ke masyarakat meski belum masa kampanye https:\/\/t.co\/x7uh8iu44y #riau,0,alasan anies sering turun ke masyarakat meski belum masa kampanye  #riau,alasan anies sering turun ke masyarakat meski belum masa kampanye  riau,alasan anies sering turun ke masyarakat meski belum masa kampanye riau,alas anies sering turun ke masyarakat meski belum masa kampanye riau,alas anies turun masyarakat kampanye riau,alasan anies turun masyarakat kampanye riau
1148,"@matanajwa sby masa depan, mudah2an ltar blkang tni mmbuat pak agus jauh lbih bsa mrubah jakarta, bila trpilih",1," sby masa depan, mudah2an ltar blkang tni mmbuat pak agus jauh lbih bsa mrubah jakarta, bila trpilih", sby masa depan mudahan ltar blkang tni mmbuat pak agus jauh lbih bsa mrubah jakarta bila trpilih,surabaya masa depan mudahan ltar belakang tni mmbuat pak agus jauh lebih bisa mrubah jakarta bila trpilih,surabaya masa depan mudah ltar belakang tni mmbuat pak agus jauh lebih bisa mrubah jakarta bila trpilih,surabaya mudah ltar tni mmbuat agus mrubah jakarta trpilih,surabaya mudahan ltar tni mmbuat agus mrubah jakarta trpilih
1149,alasan anies sering turun ke masyarakat meski belum masa kampanye https:\/\/t.co\/h5tvfkxahk,1,alasan anies sering turun ke masyarakat meski belum masa kampanye ,alasan anies sering turun ke masyarakat meski belum masa kampanye ,alasan anies sering turun ke masyarakat meski belum masa kampanye,alas anies sering turun ke masyarakat meski belum masa kampanye,alas anies turun masyarakat kampanye,alasan anies turun masyarakat kampanye
1150,rt @darwistriadi: sangat salut dgn nusron wahid dlm argumentasi di ilc.. soal ahok..kita perlu lbh banyak lg di indonesia org2 seperti dia.\u2026,1, sangat salut dgn nusron wahid dlm argumentasi di ilc.. soal ahok..kita perlu lbh banyak lg di indonesia org2 seperti dia.\u2026, sangat salut dgn nusron wahid dlm argumentasi di ilc soal ahokkita perlu lbh banyak lg di indonesia org seperti diau,sangat salut dengan nusron wahid dalam argumentasi di ilc soal ahokkita perlu lebih banyak lagi di indonesia orang seperti diau,sangat salut dengan nusron wahid dalam argumentasi di ilc soal ahokkita perlu lebih banyak lagi di indonesia orang seperti diau,salut nusron wahid argumentasi ilc ahokkita indonesia orang diau,salut nusron wahid argumentasi ilc ahokkita indonesia orang diau
1151,rt @agusfansclub_: dan mas agus ikut dlm konstetasi politik karena dicalonkan oleh beberapa partai dan benar2 tidak pernah diduga sebelumny\u2026,0, dan mas agus ikut dlm konstetasi politik karena dicalonkan oleh beberapa partai dan benar2 tidak pernah diduga sebelumny\u2026, dan mas agus ikut dlm konstetasi politik karena dicalonkan oleh beberapa partai dan benar tidak pernah diduga sebelumnyu,dan mas agus ikut dalam konstetasi politik karena dicalonkan oleh beberapa partai dan benar tidak pernah diduga sebelumnyu,dan mas agus ikut dalam konstetasi politik karena calon oleh beberapa partai dan benar tidak pernah duga sebelumnyu,mas agus konstetasi politik calon partai duga sebelumnyu,mas agus konstetasi politik dicalonkan partai diduga sebelumnyu
1152,"rt @detikcom: ahok, agus dan anies adu program tata ruang dki, ini perbandingannya https:\/\/t.co\/tgooq6ex9j https:\/\/t.co\/bngrwjo16q",1," ahok, agus dan anies adu program tata ruang dki, ini perbandingannya  ", ahok agus dan anies adu program tata ruang dki ini perbandingannya  ,ahok agus dan anies adu program tata ruang dki ini perbandingannya,ahok agus dan anies adu program tata ruang dki ini banding,ahok agus anies adu program tata ruang dki banding,ahok agus anies adu program tata ruang dki perbandingannya
1153,rachmawati tersinggung megawati ajak ahok ke makam bung karno https:\/\/t.co\/x4w3hflokq https:\/\/t.co\/yj38gkdpau,1,rachmawati tersinggung megawati ajak ahok ke makam bung karno  ,rachmawati tersinggung megawati ajak ahok ke makam bung karno  ,rachmawati tersinggung megawati ajak ahok ke makam bung karno,rachmawati singgung megawati ajak ahok ke makam bung karno,rachmawati singgung megawati ajak ahok makam karno,rachmawati tersinggung megawati ajak ahok makam karno
1154,rt @dennyja_world: saya melihat data lsi soal pilkada dki yang mengejutkan (survei okt 2016): ahok potensial kalah!,0, saya melihat data lsi soal pilkada dki yang mengejutkan (survei okt 2016): ahok potensial kalah!, saya melihat data lsi soal pilkada dki yang mengejutkan survei okt  ahok potensial kalah,saya melihat data lsi soal pilkada dki yang mengejutkan survei okt ahok potensial kalah,saya lihat data lsi soal pilkada dki yang kejut survei okt ahok potensial kalah,lihat data lsi pilkada dki kejut survei okt ahok potensial kalah,data lsi pilkada dki mengejutkan survei okt ahok potensial kalah
1155,"terkait ahok, setara institute nilai mui berpolitik https:\/\/t.co\/4k1iiss8wl lewat @tribunnews",0,"terkait ahok, setara institute nilai mui berpolitik  lewat ",terkait ahok setara institute nilai mui berpolitik  lewat ,terkait ahok setara institute nilai mui berpolitik lewat,kait ahok tara institute nilai mui politik lewat,kait ahok tara institute nilai mui politik,terkait ahok setara institute nilai mui berpolitik
1156,rt @queenmariaeva: telinganya mui saliwang...ayo hok minta maapnye kencengan dikit https:\/\/t.co\/17gsfzjuyw,0, telinganya mui saliwang...ayo hok minta maapnye kencengan dikit , telinganya mui saliwangayo hok minta maapnye kencengan dikit ,telinganya mui saliwangayo hok meminta maapnye kencengan dikit,telinga mui saliwangayo hok minta maapnye kenceng dikit,telinga mui saliwangayo hok maapnye kenceng dikit,telinganya mui saliwangayo hok maapnye kencengan dikit
1157,rachmawati tersinggung megawati ajak ahok ke makam bung karno https:\/\/t.co\/lq6mpasejo,1,rachmawati tersinggung megawati ajak ahok ke makam bung karno ,rachmawati tersinggung megawati ajak ahok ke makam bung karno ,rachmawati tersinggung megawati ajak ahok ke makam bung karno,rachmawati singgung megawati ajak ahok ke makam bung karno,rachmawati singgung megawati ajak ahok makam karno,rachmawati tersinggung megawati ajak ahok makam karno
1158,rachmawati tersinggung megawati ajak ahok ke makam bung karno https:\/\/t.co\/iyppmcujhi,1,rachmawati tersinggung megawati ajak ahok ke makam bung karno ,rachmawati tersinggung megawati ajak ahok ke makam bung karno ,rachmawati tersinggung megawati ajak ahok ke makam bung karno,rachmawati singgung megawati ajak ahok ke makam bung karno,rachmawati singgung megawati ajak ahok makam karno,rachmawati tersinggung megawati ajak ahok makam karno
1159,rachmawati tersinggung megawati ajak ahok ke makam bung karno https:\/\/t.co\/5yyrm5yisv,1,rachmawati tersinggung megawati ajak ahok ke makam bung karno ,rachmawati tersinggung megawati ajak ahok ke makam bung karno ,rachmawati tersinggung megawati ajak ahok ke makam bung karno,rachmawati singgung megawati ajak ahok ke makam bung karno,rachmawati singgung megawati ajak ahok makam karno,rachmawati tersinggung megawati ajak ahok makam karno
1160,"ketum pkb: #ahok jangan buat resah!: \""ya saya kira semua pihak agar untuk menahan\u2026 https:\/\/t.co\/0357akoydj #aktual",0,"ketum pkb: #ahok jangan buat resah!: \""ya saya kira semua pihak agar untuk menahan\u2026  #aktual",ketum pkb ahok jangan buat resah ya saya kira semua pihak agar untuk menahanu  aktual,ketum pkb ahok jangan buat resah ya saya kira semua pihak agar untuk menahanu aktual,tum pkb ahok jangan buat resah ya saya kira semua pihak agar untuk menahanu aktual,tum pkb ahok resah ya menahanu aktual,ketum pkb ahok resah ya menahanu aktual
