,Tweet,sentimen,clean_link,hapus_punc,substitute_slang,stemming,eliminate_stop_with_stemming,eliminate_stop_without_stemming
0,"rt @napqilla: no 1, 3 ambisinya menguasai rakyat, no.2 ambisinya melayani rakyat, itu terlihat #debat2pilkadadki, mknya #loguepilihbadja aja",1," no 1, 3 ambisinya menguasai rakyat, no.2 ambisinya melayani rakyat, itu terlihat #debat2pilkadadki, mknya #loguepilihbadja aja", no   ambisinya menguasai rakyat no ambisinya melayani rakyat itu terlihat debatpilkadadki mknya loguepilihbadja aja,no ambisinya menguasai rakyat no ambisinya melayani rakyat itu terlihat debatpilkadadki makanya loguepilihbadja saja,no ambisi kuasa rakyat no ambisi layan rakyat itu lihat debatpilkadadki makanya loguepilihbadja saja,no ambisi kuasa rakyat no ambisi layan rakyat lihat debatpilkadadki loguepilihbadja,no ambisinya menguasai rakyat no ambisinya melayani rakyat debatpilkadadki loguepilihbadja
1,rt @pandji: nah gue pikir sentimen petahana oke di #debat2pilkadadki semalam. tapi mnrt politicawave malah sebaliknya. geng\u2026 ,1, nah gue pikir sentimen petahana oke di #debat2pilkadadki semalam. tapi mnrt politicawave malah sebaliknya. geng\u2026 , nah gue pikir sentimen petahana oke di debatpilkadadki semalam tapi mnrt politicawave malah sebaliknya gengu ,nah saya pikir sentimen petahana oke di debatpilkadadki semalam tapi mnrt politicawave malah sebaliknya gengu,nah saya pikir sentimen tahana oke di debatpilkadadki malam tapi mnrt politicawave malah balik gengu,pikir sentimen tahana oke debatpilkadadki malam mnrt politicawave gengu,pikir sentimen petahana oke debatpilkadadki semalam mnrt politicawave gengu
2,rt @pandji: urutan pertama best moment #debat2pilkadadki : pak basuki misahin bu sylvie &amp,1, urutan pertama best moment #debat2pilkadadki : pak basuki misahin bu sylvie &amp, urutan pertama best moment debatpilkadadki  pak basuki misahin bu sylvie amp,urutan pertama best moment debatpilkadadki pak basuki misahin bu sylvie amp,urut pertama best moment debatpilkadadki pak basuki misahin bu sylvie amp,urut best moment debatpilkadadki basuki misahin bu sylvie amp,urutan best moment debatpilkadadki basuki misahin bu sylvie amp
3,rt @pandji: ini artikel yg menjelaskan ternyata di #debat2pilkadadki yg dapet respon positif di socmed adalah #aniessandiokoce https:\/\/t.co\u2026,1, ini artikel yg menjelaskan ternyata di #debat2pilkadadki yg dapet respon positif di socmed adalah #aniessandiokoce , ini artikel yg menjelaskan ternyata di debatpilkadadki yg dapet respon positif di socmed adalah aniessandiokoce ,ini artikel yang menjelaskan ternyata di debatpilkadadki yang dapat respon positif di socmed adalah aniessandiokoce,ini artikel yang jelas nyata di debatpilkadadki yang dapat respon positif di socmed adalah aniessandiokoce,artikel nyata debatpilkadadki respon positif socmed aniessandiokoce,artikel debatpilkadadki respon positif socmed aniessandiokoce
4,rt @mrtampi: agus makin santai.\nahok makin santun.\nanies makin esmosi.\n\nimho.\n#debat2pilkadadki,0, agus makin santai.\nahok makin santun.\nanies makin esmosi.\n\nimho.\n#debat2pilkadadki, agus makin santainahok makin santunnanies makin esmosinnimhondebatpilkadadki,agus makin santainahok makin santunnanies makin esmosinnimhondebatpilkadadki,agus makin santainahok makin santunnanies makin esmosinnimhondebatpilkadadki,agus santainahok santunnanies esmosinnimhondebatpilkadadki,agus santainahok santunnanies esmosinnimhondebatpilkadadki
5,"pilkada dki jangan pilih pki!! berbahaya!! pilih 1 atau 3 saja tahun baru imlek, pkb aj... https:\/\/t.co\/ggych4sgct #debat2pilkadadki #imlek",0,"pilkada dki jangan pilih pki!! berbahaya!! pilih 1 atau 3 saja tahun baru imlek, pkb aj...  #debat2pilkadadki #imlek",pilkada dki jangan pilih pki berbahaya pilih  atau  saja tahun baru imlek pkb aj  debatpilkadadki imlek,pilkada dki jangan pilih pki berbahaya pilih atau saja tahun baru imlek pkb saja debatpilkadadki imlek,pilkada dki jangan pilih pki bahaya pilih atau saja tahun baru imlek pkb saja debatpilkadadki imlek,pilkada dki pilih pki bahaya pilih imlek pkb debatpilkadadki imlek,pilkada dki pilih pki berbahaya pilih imlek pkb debatpilkadadki imlek
6,pdip sengaja becah belah rakyat warga dki tidak pilih ahok!! wni ang... ,0,pdip sengaja becah belah rakyat warga dki tidak pilih ahok!! wni ang... ,pdip sengaja becah belah rakyat warga dki tidak pilih ahok wni ang ,pdip sengaja becah belah rakyat warga dki tidak pilih ahok wni ang,pdip sengaja becah belah rakyat warga dki tidak pilih ahok wni ang,pdip sengaja becah belah rakyat warga dki pilih ahok wni ang,pdip sengaja becah belah rakyat warga dki pilih ahok wni ang
7,nama nya juga debat\nbiasa nya itu https:\/\/t.co\/cjertypdxp,1,nama nya juga debat\nbiasa nya itu ,nama nya juga debatnbiasa nya itu ,nama nya juga debatnbiasa nya itu,nama nya juga debatnbiasa nya itu,nama nya debatnbiasa nya,nama nya debatnbiasa nya
8,"rt @dadansuwarna: kita ttp bisa bijak memilih, tanpa harus berteriak, tanpa harus mengumpat. #debat2pilkadadki #debatcagubdki",1," kita ttp bisa bijak memilih, tanpa harus berteriak, tanpa harus mengumpat. #debat2pilkadadki #debatcagubdki", kita ttp bisa bijak memilih tanpa harus berteriak tanpa harus mengumpat debatpilkadadki debatcagubdki,kita tetap bisa bijak memilih tanpa harus berteriak tanpa harus mengumpat debatpilkadadki debatcagubdki,kita tetap bisa bijak pilih tanpa harus teriak tanpa harus umpat debatpilkadadki debatcagubdki,bijak pilih teriak umpat debatpilkadadki debatcagubdki,bijak memilih berteriak mengumpat debatpilkadadki debatcagubdki
9,"rt @aniesbaswedan: ibu, terima kasih atas doa dan kumpulan pelajaran yang telah membangun pemikiran, karakter dan semangat untuk berju\u2026 ",1," ibu, terima kasih atas doa dan kumpulan pelajaran yang telah membangun pemikiran, karakter dan semangat untuk berju\u2026 ", ibu terima kasih atas doa dan kumpulan pelajaran yang telah membangun pemikiran karakter dan semangat untuk berjuu ,ibu terima kasih atas doa dan kumpulan pelajaran yang telah membangun pemikiran karakter dan semangat untuk berjuu,ibu terima kasih atas doa dan kumpul ajar yang telah bangun pikir karakter dan semangat untuk berjuu,terima kasih doa kumpul ajar bangun pikir karakter semangat berjuu,terima kasih doa kumpulan pelajaran membangun pemikiran karakter semangat berjuu
10,"rt @gunromli: sylviana kesyikan ngomong sendiri lupa bertanya, anies keasyikan nyerang pake data2 yg salah, ya ahok joged2 aja \ud83d\ude01 #debat2pil\u2026",0," sylviana kesyikan ngomong sendiri lupa bertanya, anies keasyikan nyerang pake data2 yg salah, ya ahok joged2 aja \ud83d\ude01 #debat2pil\u2026", sylviana kesyikan ngomong sendiri lupa bertanya anies keasyikan nyerang pake data yg salah ya ahok joged aja uddude debatpilu,sylviana kesyikan mengomong sendiri lupa bertanya anies keasyikan menyerang pakai data yang salah ya ahok joged saja uddude debatpilu,sylviana kesyikan omong sendiri lupa tanya anies asyik serang pakai data yang salah ya ahok joged saja uddude debatpilu,sylviana kesyikan omong lupa anies asyik serang pakai data salah ya ahok joged uddude debatpilu,sylviana kesyikan mengomong lupa anies keasyikan menyerang pakai data salah ya ahok joged uddude debatpilu
11,"rt @gunromli: sylviana kesyikan ngomong sendiri lupa bertanya, anies keasyikan nyerang pake data2 yg salah, ya ahok joged2 aja \ud83d\ude01 #debat2pil\u2026",0," sylviana kesyikan ngomong sendiri lupa bertanya, anies keasyikan nyerang pake data2 yg salah, ya ahok joged2 aja \ud83d\ude01 #debat2pil\u2026", sylviana kesyikan ngomong sendiri lupa bertanya anies keasyikan nyerang pake data yg salah ya ahok joged aja uddude debatpilu,sylviana kesyikan mengomong sendiri lupa bertanya anies keasyikan menyerang pakai data yang salah ya ahok joged saja uddude debatpilu,sylviana kesyikan omong sendiri lupa tanya anies asyik serang pakai data yang salah ya ahok joged saja uddude debatpilu,sylviana kesyikan omong lupa anies asyik serang pakai data salah ya ahok joged uddude debatpilu,sylviana kesyikan mengomong lupa anies keasyikan menyerang pakai data salah ya ahok joged uddude debatpilu
12,"rt @gunromli: sylviana kesyikan ngomong sendiri lupa bertanya, anies keasyikan nyerang pake data2 yg salah, ya ahok joged2 aja \ud83d\ude01 #debat2pil\u2026",0," sylviana kesyikan ngomong sendiri lupa bertanya, anies keasyikan nyerang pake data2 yg salah, ya ahok joged2 aja \ud83d\ude01 #debat2pil\u2026", sylviana kesyikan ngomong sendiri lupa bertanya anies keasyikan nyerang pake data yg salah ya ahok joged aja uddude debatpilu,sylviana kesyikan mengomong sendiri lupa bertanya anies keasyikan menyerang pakai data yang salah ya ahok joged saja uddude debatpilu,sylviana kesyikan omong sendiri lupa tanya anies asyik serang pakai data yang salah ya ahok joged saja uddude debatpilu,sylviana kesyikan omong lupa anies asyik serang pakai data salah ya ahok joged uddude debatpilu,sylviana kesyikan mengomong lupa anies keasyikan menyerang pakai data salah ya ahok joged uddude debatpilu
13,"rt @gunromli: sylviana kesyikan ngomong sendiri lupa bertanya, anies keasyikan nyerang pake data2 yg salah, ya ahok joged2 aja  #debat2pil\u2026",0," sylviana kesyikan ngomong sendiri lupa bertanya, anies keasyikan nyerang pake data2 yg salah, ya ahok joged2 aja  #debat2pil\u2026", sylviana kesyikan ngomong sendiri lupa bertanya anies keasyikan nyerang pake data yg salah ya ahok joged aja  debatpilu,sylviana kesyikan mengomong sendiri lupa bertanya anies keasyikan menyerang pakai data yang salah ya ahok joged saja debatpilu,sylviana kesyikan omong sendiri lupa tanya anies asyik serang pakai data yang salah ya ahok joged saja debatpilu,sylviana kesyikan omong lupa anies asyik serang pakai data salah ya ahok joged debatpilu,sylviana kesyikan mengomong lupa anies keasyikan menyerang pakai data salah ya ahok joged debatpilu
14,"rt @jokoanwar: tiap ahok djarot ngomong, nambah ilmu ya kita. #debat2pilkadadki https:\/\/t.co\/xwwrnalpbu",1," tiap ahok djarot ngomong, nambah ilmu ya kita. #debat2pilkadadki ", tiap ahok djarot ngomong nambah ilmu ya kita debatpilkadadki ,tiap ahok djarot mengomong bertambah ilmu ya kita debatpilkadadki,tiap ahok djarot omong tambah ilmu ya kita debatpilkadadki,ahok djarot omong ilmu ya debatpilkadadki,ahok djarot mengomong bertambah ilmu ya debatpilkadadki
15,rt @jessyastrid: makasih @yosimokalu jangan kasih kendor untuk #1putaran #2periode #debat2pilkadadki salam dua jadiiii\u270c\u270c https:\/\/t.co\/jb5la\u2026,1, makasih  jangan kasih kendor untuk #1putaran #2periode #debat2pilkadadki salam dua jadiiii\u270c\u270c , makasih  jangan kasih kendor untuk putaran periode debatpilkadadki salam dua jadiiiiucuc ,terima kasih jangan kasih kendor untuk putaran periode debatpilkadadki salam dua jadiiucuc,terima kasih jangan kasih kendor untuk putar periode debatpilkadadki salam dua jadiiucuc,terima kasih kasih kendor putar periode debatpilkadadki salam jadiiucuc,terima kasih kasih kendor putaran periode debatpilkadadki salam jadiiucuc
16,rt @kimochiii_: \ud83c\udfa4mohon bersabar ini ujian \ud83d\ude14#debat2pilkadadki https:\/\/t.co\/ihw6yznay4,1, \ud83c\udfa4mohon bersabar ini ujian \ud83d\ude14#debat2pilkadadki , udcudfamohon bersabar ini ujian uddudedebatpilkadadki ,udcudfamohon bersabar ini ujian uddudedebatpilkadadki,udcudfamohon sabar ini uji uddudedebatpilkadadki,udcudfamohon sabar uji uddudedebatpilkadadki,udcudfamohon bersabar ujian uddudedebatpilkadadki
17,rt @teddygusnaidi: 33. inilah gambaran yg saya sampaikan sebagai pendidikan politik agar supaya masyarakat tau siapa agus &amp,1, 33. inilah gambaran yg saya sampaikan sebagai pendidikan politik agar supaya masyarakat tau siapa agus &amp,  inilah gambaran yg saya sampaikan sebagai pendidikan politik agar supaya masyarakat tau siapa agus amp,inilah gambaran yang saya sampaikan sebagai pendidikan politik agar supaya masyarakat tahu siapa agus amp,ini gambar yang saya sampai bagai didik politik agar supaya masyarakat tahu siapa agus amp,gambar didik politik masyarakat agus amp,gambaran pendidikan politik masyarakat agus amp
18,#debat2pilkadadki orang-orang yang berhenti belajar akan menjadi pemilik masa lalu. orang-orang yang masih terus b #nomor1.com #gunaal101,1,#debat2pilkadadki orang-orang yang berhenti belajar akan menjadi pemilik masa lalu. orang-orang yang masih terus b #nomor1.com #gunaal101,debatpilkadadki orangorang yang berhenti belajar akan menjadi pemilik masa lalu orangorang yang masih terus b nomorcom gunaal,debatpilkadadki orangorang yang berhenti belajar akan menjadi pemilik masa lalu orangorang yang masih terus b nomorcom gunaal,debatpilkadadki orangorang yang henti ajar akan jadi milik masa lalu orangorang yang masih terus b nomorcom gunaal,debatpilkadadki orangorang henti ajar milik orangorang b nomorcom gunaal,debatpilkadadki orangorang berhenti belajar pemilik orangorang b nomorcom gunaal
19,"as usual, ga pernah menjawab dgn solusi.",0,"as usual, ga pernah menjawab dgn solusi.",as usual ga pernah menjawab dgn solusi,as usual tidak pernah menjawab dengan solusi,as usual tidak pernah jawab dengan solusi,as usual solusi,as usual solusi
20,yah namanya jh odong2 si @sylviana_murni https:\/\/t.co\/8g7u4iuyo7,0,yah namanya jh odong2 si  ,yah namanya jh odong si  ,ya namanya saja odong sih,ya nama saja odong sih,ya nama odong sih,ya namanya odong sih
21,"rt @gunromli: sylviana kesyikan ngomong sendiri lupa bertanya, anies keasyikan nyerang pake data2 yg salah, ya ahok joged2 aja \ud83d\ude01 #debat2pil\u2026",0," sylviana kesyikan ngomong sendiri lupa bertanya, anies keasyikan nyerang pake data2 yg salah, ya ahok joged2 aja \ud83d\ude01 #debat2pil\u2026", sylviana kesyikan ngomong sendiri lupa bertanya anies keasyikan nyerang pake data yg salah ya ahok joged aja uddude debatpilu,sylviana kesyikan mengomong sendiri lupa bertanya anies keasyikan menyerang pakai data yang salah ya ahok joged saja uddude debatpilu,sylviana kesyikan omong sendiri lupa tanya anies asyik serang pakai data yang salah ya ahok joged saja uddude debatpilu,sylviana kesyikan omong lupa anies asyik serang pakai data salah ya ahok joged uddude debatpilu,sylviana kesyikan mengomong lupa anies keasyikan menyerang pakai data salah ya ahok joged uddude debatpilu
22,"rt @komunitaskata: #debat2pilkadadki bohongi bohongi terus org pakai opini kinerja baik, pdhl kinerjanya absolutely buruk! https:\/\/t.co\/m8g\u2026",0," #debat2pilkadadki bohongi bohongi terus org pakai opini kinerja baik, pdhl kinerjanya absolutely buruk! ", debatpilkadadki bohongi bohongi terus org pakai opini kinerja baik pdhl kinerjanya absolutely buruk ,debatpilkadadki bohongi bohongi terus orang pakai opini kinerja baik padahal kinerjanya absolutely buruk,debatpilkadadki bohong bohong terus orang pakai opini kerja baik padahal kerja absolutely buruk,debatpilkadadki bohong bohong orang pakai opini kerja kerja absolutely buruk,debatpilkadadki bohongi bohongi orang pakai opini kinerja kinerjanya absolutely buruk
23,pdip sengaja becah belah rakyat warga dki tidak pilih ahok!! pria as... https:\/\/t.co\/315l4axm8h #debat2pilkadadki https:\/\/t.co\/ybh5dtxnw2,0,pdip sengaja becah belah rakyat warga dki tidak pilih ahok!! pria as...  #debat2pilkadadki ,pdip sengaja becah belah rakyat warga dki tidak pilih ahok pria as  debatpilkadadki ,pdip sengaja becah belah rakyat warga dki tidak pilih ahok pria as debatpilkadadki,pdip sengaja becah belah rakyat warga dki tidak pilih ahok pria as debatpilkadadki,pdip sengaja becah belah rakyat warga dki pilih ahok pria as debatpilkadadki,pdip sengaja becah belah rakyat warga dki pilih ahok pria as debatpilkadadki
24,"rt @teddygusnaidi: ini yg gue bilang, yg hebat di tim @agusyudhoyono itu cuma tukang fotonya. coba zoom. orangnya dikit, kebyakan bers\u2026 ",0," ini yg gue bilang, yg hebat di tim  itu cuma tukang fotonya. coba zoom. orangnya dikit, kebyakan bers\u2026 ", ini yg gue bilang yg hebat di tim  itu cuma tukang fotonya coba zoom orangnya dikit kebyakan bersu ,ini yang saya bilang yang hebat di tim itu cuma tukang fotonya coba zoom orangnya dikit kebyakan bersu,ini yang saya bilang yang hebat di tim itu cuma tukang foto coba zoom orang dikit kebyakan bersu,bilang hebat tim tukang foto coba zoom orang dikit kebyakan bersu,bilang hebat tim tukang fotonya coba zoom orangnya dikit kebyakan bersu
25,pdip sengaja becah belah rakyat warga dki tidak pilih ahok!! dua gan... https:\/\/t.co\/dojksgdiwv #debat2pilkadadki https:\/\/t.co\/ebhmnmgaq3,0,pdip sengaja becah belah rakyat warga dki tidak pilih ahok!! dua gan...  #debat2pilkadadki ,pdip sengaja becah belah rakyat warga dki tidak pilih ahok dua gan  debatpilkadadki ,pdip sengaja becah belah rakyat warga dki tidak pilih ahok dua gan debatpilkadadki,pdip sengaja becah belah rakyat warga dki tidak pilih ahok dua gan debatpilkadadki,pdip sengaja becah belah rakyat warga dki pilih ahok gan debatpilkadadki,pdip sengaja becah belah rakyat warga dki pilih ahok gan debatpilkadadki
26,"pilkada dki jangan pilih pki!! berbahaya!! pilih 1 atau 3 saja tahun baru imlek, pkb aj... https:\/\/t.co\/1cvtw2ahuv #debat2pilkadadki #imlek",0,"pilkada dki jangan pilih pki!! berbahaya!! pilih 1 atau 3 saja tahun baru imlek, pkb aj...  #debat2pilkadadki #imlek",pilkada dki jangan pilih pki berbahaya pilih  atau  saja tahun baru imlek pkb aj  debatpilkadadki imlek,pilkada dki jangan pilih pki berbahaya pilih atau saja tahun baru imlek pkb saja debatpilkadadki imlek,pilkada dki jangan pilih pki bahaya pilih atau saja tahun baru imlek pkb saja debatpilkadadki imlek,pilkada dki pilih pki bahaya pilih imlek pkb debatpilkadadki imlek,pilkada dki pilih pki berbahaya pilih imlek pkb debatpilkadadki imlek
27,"rt @novnuraidah: sy ga percaya mpok @sylviana_murni melakukan gesture jempol yg sgt bad attitude ini.moga hanya editan, ini hanya uj\u2026 ",1," sy ga percaya mpok  melakukan gesture jempol yg sgt bad attitude ini.moga hanya editan, ini hanya uj\u2026 ", sy ga percaya mpok  melakukan gesture jempol yg sgt bad attitude inimoga hanya editan ini hanya uju ,saya tidak percaya mpok melakukan gesture jempol yang sangat bad attitude inimoga hanya editan ini hanya uju,saya tidak percaya mpok laku gesture jempol yang sangat bad attitude inimoga hanya edit ini hanya uju,percaya mpok laku gesture jempol bad attitude inimoga edit uju,percaya mpok gesture jempol bad attitude inimoga editan uju
28,"rt @gunromli: sylviana kesyikan ngomong sendiri lupa bertanya, anies keasyikan nyerang pake data2 yg salah, ya ahok joged2 aja \ud83d\ude01 #debat2pil\u2026",1," sylviana kesyikan ngomong sendiri lupa bertanya, anies keasyikan nyerang pake data2 yg salah, ya ahok joged2 aja \ud83d\ude01 #debat2pil\u2026", sylviana kesyikan ngomong sendiri lupa bertanya anies keasyikan nyerang pake data yg salah ya ahok joged aja uddude debatpilu,sylviana kesyikan mengomong sendiri lupa bertanya anies keasyikan menyerang pakai data yang salah ya ahok joged saja uddude debatpilu,sylviana kesyikan omong sendiri lupa tanya anies asyik serang pakai data yang salah ya ahok joged saja uddude debatpilu,sylviana kesyikan omong lupa anies asyik serang pakai data salah ya ahok joged uddude debatpilu,sylviana kesyikan mengomong lupa anies keasyikan menyerang pakai data salah ya ahok joged uddude debatpilu
29,makanya prof rhenald kasali bilang bhw dlm #debat2pilkadadki trjd pertarungan 1 lawan 3 \ud83d\ude06\n https:\/\/t.co\/qpyxtj1ybn,1,makanya prof rhenald kasali bilang bhw dlm #debat2pilkadadki trjd pertarungan 1 lawan 3 \ud83d\ude06\n ,makanya prof rhenald kasali bilang bhw dlm debatpilkadadki trjd pertarungan  lawan  udduden ,makanya prof rhenald kasali bilang bahwa dalam debatpilkadadki terjadi pertarungan lawan udduden,makanya prof rhenald kasali bilang bahwa dalam debatpilkadadki jadi tarung lawan udduden,prof rhenald kasali bilang debatpilkadadki tarung lawan udduden,prof rhenald kasali bilang debatpilkadadki pertarungan lawan udduden
30,rt @teddygusnaidi: 33. inilah gambaran yg saya sampaikan sebagai pendidikan politik agar supaya masyarakat tau siapa agus &amp,1, 33. inilah gambaran yg saya sampaikan sebagai pendidikan politik agar supaya masyarakat tau siapa agus &amp,  inilah gambaran yg saya sampaikan sebagai pendidikan politik agar supaya masyarakat tau siapa agus amp,inilah gambaran yang saya sampaikan sebagai pendidikan politik agar supaya masyarakat tahu siapa agus amp,ini gambar yang saya sampai bagai didik politik agar supaya masyarakat tahu siapa agus amp,gambar didik politik masyarakat agus amp,gambaran pendidikan politik masyarakat agus amp
31,"dalam hidup,terkadang kita lebih banyak mendapatkan apa yang tidak kita inginkan. dan ketika ki #nomor1.net #ariesya258 #debat2pilkadadki",1,"dalam hidup,terkadang kita lebih banyak mendapatkan apa yang tidak kita inginkan. dan ketika ki #nomor1.net #ariesya258 #debat2pilkadadki",dalam hidupterkadang kita lebih banyak mendapatkan apa yang tidak kita inginkan dan ketika ki nomornet ariesya debatpilkadadki,dalam hidupterkadang kita lebih banyak mendapatkan apa yang tidak kita inginkan dan ketika ki nomornet ariesya debatpilkadadki,dalam hidupterkadang kita lebih banyak dapat apa yang tidak kita ingin dan ketika ki nomornet ariesya debatpilkadadki,hidupterkadang ki nomornet ariesya debatpilkadadki,hidupterkadang ki nomornet ariesya debatpilkadadki
32,rt @teddygusnaidi: 27. kalau gunakan fantasi agus maka agus bisa menuding bahwa sby tidak beres memimpin. 10 tahun masih banyak yang miskin\u2026,0, 27. kalau gunakan fantasi agus maka agus bisa menuding bahwa sby tidak beres memimpin. 10 tahun masih banyak yang miskin\u2026,  kalau gunakan fantasi agus maka agus bisa menuding bahwa sby tidak beres memimpin  tahun masih banyak yang miskinu,kalau gunakan fantasi agus maka agus bisa menuding bahwa surabaya tidak beres memimpin tahun masih banyak yang miskinu,kalau guna fantasi agus maka agus bisa tuding bahwa surabaya tidak beres pimpin tahun masih banyak yang miskinu,fantasi agus agus tuding surabaya beres pimpin miskinu,fantasi agus agus menuding surabaya beres memimpin miskinu
33,"rt @teddygusnaidi: 28. kalau gunakan fantasi anies, maka anies bisa menuding bhw ali sadikin bapaknya boy sadikin gak beres memimpin jakart\u2026",0," 28. kalau gunakan fantasi anies, maka anies bisa menuding bhw ali sadikin bapaknya boy sadikin gak beres memimpin jakart\u2026",  kalau gunakan fantasi anies maka anies bisa menuding bhw ali sadikin bapaknya boy sadikin gak beres memimpin jakartu,kalau gunakan fantasi anies maka anies bisa menuding bahwa ali sadikin bapaknya boy sadikin tidak beres memimpin jakartu,kalau guna fantasi anies maka anies bisa tuding bahwa ali sadikin bapak boy sadikin tidak beres pimpin jakartu,fantasi anies anies tuding ali sadikin boy sadikin beres pimpin jakartu,fantasi anies anies menuding ali sadikin bapaknya boy sadikin beres memimpin jakartu
34,rt @teddygusnaidi: para pemuja-pemuji @agusyudhoyono kalau msh juga memuji ini keterlaluan... mbok ya kalau tugas boleh tapi realistis\u2026 ,0, para pemuja-pemuji  kalau msh juga memuji ini keterlaluan... mbok ya kalau tugas boleh tapi realistis\u2026 , para pemujapemuji  kalau msh juga memuji ini keterlaluan mbok ya kalau tugas boleh tapi realistisu ,para pemujapemuji kalau masih juga memuji ini keterlaluan mbok ya kalau tugas boleh tapi realistisu,para pemujapemuji kalau masih juga puji ini terlalu mbok ya kalau tugas boleh tapi realistisu,pemujapemuji puji mbok ya tugas realistisu,pemujapemuji memuji mbok ya tugas realistisu
35,rt @fariji_lacak: maklum...namanya jg paslon hapalan. https:\/\/t.co\/wkosscn3ds,0, maklum...namanya jg paslon hapalan. , maklumnamanya jg paslon hapalan ,maklumnamanya juga paslon hapalan,maklumnamanya juga paslon hapalan,maklumnamanya paslon hapalan,maklumnamanya paslon hapalan
36,rt @aef8386: kata @aniesbaswedan ipm di ibu kota manapun di seluruh dunia sll plg tinggi. benarkah? di amerika ternyata tidak be\u2026 ,0, kata  ipm di ibu kota manapun di seluruh dunia sll plg tinggi. benarkah? di amerika ternyata tidak be\u2026 , kata  ipm di ibu kota manapun di seluruh dunia sll plg tinggi benarkah di amerika ternyata tidak beu ,kata ipm di ibu kota manapun di seluruh dunia selalu pulang tinggi benarkah di amerika ternyata tidak beu,kata ipm di ibu kota mana di seluruh dunia selalu pulang tinggi benar di amerika nyata tidak beu,ipm kota dunia pulang amerika nyata beu,ipm kota manapun dunia pulang amerika beu
37,"pilkada dki jakarta harap tidak pilih nomor 2, bahaya laten komunis!... https:\/\/t.co\/hfzknf0wp0 #debat2pilkadadki https:\/\/t.co\/oupxyfrkuj",0,"pilkada dki jakarta harap tidak pilih nomor 2, bahaya laten komunis!...  #debat2pilkadadki ",pilkada dki jakarta harap tidak pilih nomor  bahaya laten komunis  debatpilkadadki ,pilkada dki jakarta harap tidak pilih nomor bahaya laten komunis debatpilkadadki,pilkada dki jakarta harap tidak pilih nomor bahaya laten komunis debatpilkadadki,pilkada dki jakarta harap pilih nomor bahaya laten komunis debatpilkadadki,pilkada dki jakarta harap pilih nomor bahaya laten komunis debatpilkadadki
38,rt @stellakarunia: jangan pilih cagub yg dekat dgn sarang koruptor \ud83d\ude01#debat2pilkadadki https:\/\/t.co\/ttxy2oxi6p,0, jangan pilih cagub yg dekat dgn sarang koruptor \ud83d\ude01#debat2pilkadadki , jangan pilih cagub yg dekat dgn sarang koruptor uddudedebatpilkadadki ,jangan pilih cagub yang dekat dengan sarang koruptor uddudedebatpilkadadki,jangan pilih cagub yang dekat dengan sarang koruptor uddudedebatpilkadadki,pilih cagub sarang koruptor uddudedebatpilkadadki,pilih cagub sarang koruptor uddudedebatpilkadadki
