,Tweet,sentimen,clean_link,hapus_punc,substitute_slang,stemming,eliminate_stop_with_stemming,eliminate_stop_without_stemming
750,ganti dia pikir dia paling pintar boleh om? https:\/\/t.co\/ex0jjehm8j,1,ganti dia pikir dia paling pintar boleh om? ,ganti dia pikir dia paling pintar boleh om ,ganti dia pikir dia paling pintar boleh om,ganti dia pikir dia paling pintar boleh om,ganti pikir pintar om,ganti pikir pintar om
751,"rt @teddygusnaidi: 5. tidak bisa dalam waktu 2 tahun hrs membereskan semuanya, karena masih ada yg dalam progres. ini bukan sulap simsalabi\u2026",1," 5. tidak bisa dalam waktu 2 tahun hrs membereskan semuanya, karena masih ada yg dalam progres. ini bukan sulap simsalabi\u2026",  tidak bisa dalam waktu  tahun hrs membereskan semuanya karena masih ada yg dalam progres ini bukan sulap simsalabiu,tidak bisa dalam waktu tahun harus membereskan semuanya karena masih ada yang dalam progres ini bukan sulap simsalabiu,tidak bisa dalam waktu tahun harus beres semua karena masih ada yang dalam progres ini bukan sulap simsalabiu,beres progres sulap simsalabiu,membereskan progres sulap simsalabiu
752,rt @triatmojo: ahok strukturnya bagus: identified problem &gt,1, ahok strukturnya bagus: identified problem &gt, ahok strukturnya bagus identified problem gt,ahok strukturnya bagus identified problem begitu,ahok struktur bagus identified problem begitu,ahok struktur bagus identified problem,ahok strukturnya bagus identified problem
753,"rt @jokoanwar: tiap ahok djarot ngomong, nambah ilmu ya kita. #debat2pilkadadki https:\/\/t.co\/xwwrnalpbu",1," tiap ahok djarot ngomong, nambah ilmu ya kita. #debat2pilkadadki ", tiap ahok djarot ngomong nambah ilmu ya kita debatpilkadadki ,tiap ahok djarot mengomong bertambah ilmu ya kita debatpilkadadki,tiap ahok djarot omong tambah ilmu ya kita debatpilkadadki,ahok djarot omong ilmu ya debatpilkadadki,ahok djarot mengomong bertambah ilmu ya debatpilkadadki
754,rt @ulinyusron: ikhtisar #debat2pilkadadki \n\n1. just duit\n2. just do it\n3. just do if,1, ikhtisar #debat2pilkadadki \n\n1. just duit\n2. just do it\n3. just do if, ikhtisar debatpilkadadki nn just duitn just do itn just do if,ikhtisar debatpilkadadki nn just duitn just di itn just di if,ikhtisar debatpilkadadki nn just duitn just di itn just di if,ikhtisar debatpilkadadki nn just duitn just itn just if,ikhtisar debatpilkadadki nn just duitn just itn just if
755,rt @kompastekno: temuan mengejutkan keramaian twitter di #debat2pilkadadki dan soal pendukung ahok https:\/\/t.co\/xazqwo7onh,1, temuan mengejutkan keramaian twitter di #debat2pilkadadki dan soal pendukung ahok , temuan mengejutkan keramaian twitter di debatpilkadadki dan soal pendukung ahok ,temuan mengejutkan keramaian twitter di debatpilkadadki dan soal pendukung ahok,temu kejut ramai twitter di debatpilkadadki dan soal dukung ahok,temu kejut ramai twitter debatpilkadadki dukung ahok,temuan mengejutkan keramaian twitter debatpilkadadki pendukung ahok
756,"rt @putra131093: #debat2pilkadadki ahy debatnya udah kelas capres aja tegas,cerdas,dan berwibawa https:\/\/t.co\/eujo96bwby",1," #debat2pilkadadki ahy debatnya udah kelas capres aja tegas,cerdas,dan berwibawa ", debatpilkadadki ahy debatnya udah kelas capres aja tegascerdasdan berwibawa ,debatpilkadadki ahy debatnya sudah kelas capres saja tegascerdasdan berwibawa,debatpilkadadki ahy debat sudah kelas capres saja tegascerdasdan wibawa,debatpilkadadki ahy debat kelas capres tegascerdasdan wibawa,debatpilkadadki ahy debatnya kelas capres tegascerdasdan berwibawa
757,"rt @gunromli: sylviana kesyikan ngomong sendiri lupa bertanya, anies keasyikan nyerang pake data2 yg salah, ya ahok joged2 aja \ud83d\ude01 #debat2pil\u2026",1," sylviana kesyikan ngomong sendiri lupa bertanya, anies keasyikan nyerang pake data2 yg salah, ya ahok joged2 aja \ud83d\ude01 #debat2pil\u2026", sylviana kesyikan ngomong sendiri lupa bertanya anies keasyikan nyerang pake data yg salah ya ahok joged aja uddude debatpilu,sylviana kesyikan mengomong sendiri lupa bertanya anies keasyikan menyerang pakai data yang salah ya ahok joged saja uddude debatpilu,sylviana kesyikan omong sendiri lupa tanya anies asyik serang pakai data yang salah ya ahok joged saja uddude debatpilu,sylviana kesyikan omong lupa anies asyik serang pakai data salah ya ahok joged uddude debatpilu,sylviana kesyikan mengomong lupa anies keasyikan menyerang pakai data salah ya ahok joged uddude debatpilu
758,rt @teddygusnaidi: para pemuja-pemuji @agusyudhoyono kalau msh juga memuji ini keterlaluan... mbok ya kalau tugas boleh tapi realistis\u2026 ,1, para pemuja-pemuji  kalau msh juga memuji ini keterlaluan... mbok ya kalau tugas boleh tapi realistis\u2026 , para pemujapemuji  kalau msh juga memuji ini keterlaluan mbok ya kalau tugas boleh tapi realistisu ,para pemujapemuji kalau masih juga memuji ini keterlaluan mbok ya kalau tugas boleh tapi realistisu,para pemujapemuji kalau masih juga puji ini terlalu mbok ya kalau tugas boleh tapi realistisu,pemujapemuji puji mbok ya tugas realistisu,pemujapemuji memuji mbok ya tugas realistisu
759,rt @iankomeng: #debat2pilkadadki\n@aniesbaswedan coba deh buka mata dan hati lebar lebar dan legowo.\npak @jokowi pantas saja buang\u2026 ,1, #debat2pilkadadki\n coba deh buka mata dan hati lebar lebar dan legowo.\npak  pantas saja buang\u2026 , debatpilkadadkin coba deh buka mata dan hati lebar lebar dan legowonpak  pantas saja buangu ,debatpilkadadkin coba deh buka mata dan hati lebar lebar dan legowonpak pantas saja buangu,debatpilkadadkin coba deh buka mata dan hati lebar lebar dan legowonpak pantas saja buangu,debatpilkadadkin coba deh buka mata hati lebar lebar legowonpak buangu,debatpilkadadkin coba deh buka mata hati lebar lebar legowonpak buangu
760,saya doakan semoga sampeyan jadi pemenang di kontes pilgub dki 2017. kalau sudah jadi gubernur jgn seperti ahok yg\u2026 https:\/\/t.co\/jtceftj1rk,1,saya doakan semoga sampeyan jadi pemenang di kontes pilgub dki 2017. kalau sudah jadi gubernur jgn seperti ahok yg\u2026 ,saya doakan semoga sampeyan jadi pemenang di kontes pilgub dki  kalau sudah jadi gubernur jgn seperti ahok ygu ,saya doakan semoga sampeyan jadi pemenang di kontes pilgub dki kalau sudah jadi gubernur jangan seperti ahok ygu,saya doa moga sampeyan jadi menang di kontes pilgub dki kalau sudah jadi gubernur jangan seperti ahok ygu,doa moga sampeyan menang kontes pilgub dki gubernur ahok ygu,doakan semoga sampeyan pemenang kontes pilgub dki gubernur ahok ygu
761,rt @ginaasz: apa cuma gue doang tiap paslon 2 ngomong volume langsung gue gedein sedangkan paslon 1\/3 ngomong langsung dikecilin lagi \ud83d\ude02 #de\u2026,1, apa cuma gue doang tiap paslon 2 ngomong volume langsung gue gedein sedangkan paslon 1\/3 ngomong langsung dikecilin lagi \ud83d\ude02 #de\u2026, apa cuma gue doang tiap paslon  ngomong volume langsung gue gedein sedangkan paslon  ngomong langsung dikecilin lagi uddude deu,apa cuma saya doang tiap paslon mengomong volume langsung saya gedein sedangkan paslon mengomong langsung dikecilin lagi uddude deu,apa cuma saya doang tiap paslon omong volume langsung saya gedein sedang paslon omong langsung dikecilin lagi uddude deu,doang paslon omong volume langsung gedein paslon omong langsung dikecilin uddude deu,doang paslon mengomong volume langsung gedein paslon mengomong langsung dikecilin uddude deu
762,"rt @teddygusnaidi: 5. tidak bisa dalam waktu 2 tahun hrs membereskan semuanya, karena masih ada yg dalam progres. ini bukan sulap simsalabi\u2026",1," 5. tidak bisa dalam waktu 2 tahun hrs membereskan semuanya, karena masih ada yg dalam progres. ini bukan sulap simsalabi\u2026",  tidak bisa dalam waktu  tahun hrs membereskan semuanya karena masih ada yg dalam progres ini bukan sulap simsalabiu,tidak bisa dalam waktu tahun harus membereskan semuanya karena masih ada yang dalam progres ini bukan sulap simsalabiu,tidak bisa dalam waktu tahun harus beres semua karena masih ada yang dalam progres ini bukan sulap simsalabiu,beres progres sulap simsalabiu,membereskan progres sulap simsalabiu
763,"rt @erixputra: jadi pertanyaannya apa? dan ahok pun joged, #debat2pilkadadki https:\/\/t.co\/ricyfbyogv",1," jadi pertanyaannya apa? dan ahok pun joged, #debat2pilkadadki ", jadi pertanyaannya apa dan ahok pun joged debatpilkadadki ,jadi pertanyaannya apa dan ahok pun joged debatpilkadadki,jadi tanya apa dan ahok pun joged debatpilkadadki,ahok joged debatpilkadadki,pertanyaannya ahok joged debatpilkadadki
764,"rt @nci4ri: pasca #debat2pilkadadki kena batunya, @agusyudhoyono dibentak kapolres jakarta selatan, karena bikin macet jalan.\nhttps:\/\/t.co\/\u2026",0," pasca #debat2pilkadadki kena batunya,  dibentak kapolres jakarta selatan, karena bikin macet jalan.\n", pasca debatpilkadadki kena batunya  dibentak kapolres jakarta selatan karena bikin macet jalann,pasca debatpilkadadki kena batunya dibentak kapolres jakarta selatan karena bikin macet jalann,pasca debatpilkadadki kena batu bentak kapolres jakarta selatan karena bikin macet jalann,pasca debatpilkadadki kena batu bentak kapolres jakarta selatan bikin macet jalann,pasca debatpilkadadki kena batunya dibentak kapolres jakarta selatan bikin macet jalann
765,pilkada dki jangan pilih pki!! berbahaya!! pilih 1 atau 3 saja pungli di dinas penanama... https:\/\/t.co\/n1ypjew3nq #debat2pilkadadki #imlek,0,pilkada dki jangan pilih pki!! berbahaya!! pilih 1 atau 3 saja pungli di dinas penanama...  #debat2pilkadadki #imlek,pilkada dki jangan pilih pki berbahaya pilih  atau  saja pungli di dinas penanama  debatpilkadadki imlek,pilkada dki jangan pilih pki berbahaya pilih atau saja pungli di dinas penanama debatpilkadadki imlek,pilkada dki jangan pilih pki bahaya pilih atau saja pungli di dinas penanama debatpilkadadki imlek,pilkada dki pilih pki bahaya pilih pungli dinas penanama debatpilkadadki imlek,pilkada dki pilih pki berbahaya pilih pungli dinas penanama debatpilkadadki imlek
766,#debat2pilkadadki gw bisa bayangin demo sepanjang tahun dgn kerugian materil-non materil jika no.2 msh nongol di dki. negara tdk kondusif,0,#debat2pilkadadki gw bisa bayangin demo sepanjang tahun dgn kerugian materil-non materil jika no.2 msh nongol di dki. negara tdk kondusif,debatpilkadadki gw bisa bayangin demo sepanjang tahun dgn kerugian materilnon materil jika no msh nongol di dki negara tdk kondusif,debatpilkadadki saya bisa bayangkan demo sepanjang tahun dengan kerugian materilnon materil jika no masih nongol di dki negara tidak kondusif,debatpilkadadki saya bisa bayang demo panjang tahun dengan rugi materilnon materil jika no masih nongol di dki negara tidak kondusif,debatpilkadadki bayang demo rugi materilnon materil no nongol dki negara kondusif,debatpilkadadki bayangkan demo kerugian materilnon materil no nongol dki negara kondusif
767,"rt @ichakeljombar: seorang dosen yang seharusnya dikagumi karena cerdas otaknya, tapi seketika runtuh karena hobinya menjatuhkan orang lain\u2026",1," seorang dosen yang seharusnya dikagumi karena cerdas otaknya, tapi seketika runtuh karena hobinya menjatuhkan orang lain\u2026", seorang dosen yang seharusnya dikagumi karena cerdas otaknya tapi seketika runtuh karena hobinya menjatuhkan orang lainu,seorang dosen yang seharusnya dikagumi karena cerdas otaknya tapi seketika runtuh karena hobinya menjatuhkan orang lainu,orang dosen yang harus kagum karena cerdas otak tapi ketika runtuh karena hobi jatuh orang lainu,orang dosen kagum cerdas otak runtuh hobi jatuh orang lainu,dosen dikagumi cerdas otaknya runtuh hobinya menjatuhkan orang lainu
768,"rt @putra131093: #debat2pilkadadki ahy debatnya udah kelas capres aja tegas,cerdas,dan berwibawa https:\/\/t.co\/eujo96bwby",1," #debat2pilkadadki ahy debatnya udah kelas capres aja tegas,cerdas,dan berwibawa ", debatpilkadadki ahy debatnya udah kelas capres aja tegascerdasdan berwibawa ,debatpilkadadki ahy debatnya sudah kelas capres saja tegascerdasdan berwibawa,debatpilkadadki ahy debat sudah kelas capres saja tegascerdasdan wibawa,debatpilkadadki ahy debat kelas capres tegascerdasdan wibawa,debatpilkadadki ahy debatnya kelas capres tegascerdasdan berwibawa
769,#debat2pilkadadki\n@aniesbaswedan coba deh buka mata dan hati lebar lebar dan legowo.\npak @jokowi pantas saja buang\u2026 https:\/\/t.co\/4slm22ntib,1,#debat2pilkadadki\n coba deh buka mata dan hati lebar lebar dan legowo.\npak  pantas saja buang\u2026 ,debatpilkadadkin coba deh buka mata dan hati lebar lebar dan legowonpak  pantas saja buangu ,debatpilkadadkin coba deh buka mata dan hati lebar lebar dan legowonpak pantas saja buangu,debatpilkadadkin coba deh buka mata dan hati lebar lebar dan legowonpak pantas saja buangu,debatpilkadadkin coba deh buka mata hati lebar lebar legowonpak buangu,debatpilkadadkin coba deh buka mata hati lebar lebar legowonpak buangu
770,rt @teddygusnaidi: 27. kalau gunakan fantasi agus maka agus bisa menuding bahwa sby tidak beres memimpin. 10 tahun masih banyak yang miskin\u2026,0, 27. kalau gunakan fantasi agus maka agus bisa menuding bahwa sby tidak beres memimpin. 10 tahun masih banyak yang miskin\u2026,  kalau gunakan fantasi agus maka agus bisa menuding bahwa sby tidak beres memimpin  tahun masih banyak yang miskinu,kalau gunakan fantasi agus maka agus bisa menuding bahwa surabaya tidak beres memimpin tahun masih banyak yang miskinu,kalau guna fantasi agus maka agus bisa tuding bahwa surabaya tidak beres pimpin tahun masih banyak yang miskinu,fantasi agus agus tuding surabaya beres pimpin miskinu,fantasi agus agus menuding surabaya beres memimpin miskinu
771,"rt @teddygusnaidi: 28. kalau gunakan fantasi anies, maka anies bisa menuding bhw ali sadikin bapaknya boy sadikin gak beres memimpin jakart\u2026",0," 28. kalau gunakan fantasi anies, maka anies bisa menuding bhw ali sadikin bapaknya boy sadikin gak beres memimpin jakart\u2026",  kalau gunakan fantasi anies maka anies bisa menuding bhw ali sadikin bapaknya boy sadikin gak beres memimpin jakartu,kalau gunakan fantasi anies maka anies bisa menuding bahwa ali sadikin bapaknya boy sadikin tidak beres memimpin jakartu,kalau guna fantasi anies maka anies bisa tuding bahwa ali sadikin bapak boy sadikin tidak beres pimpin jakartu,fantasi anies anies tuding ali sadikin boy sadikin beres pimpin jakartu,fantasi anies anies menuding ali sadikin bapaknya boy sadikin beres memimpin jakartu
772,"pilkada dki jakarta harap tidak pilih nomor 2, bahaya laten komunis!... https:\/\/t.co\/5wp4mmnegt #debat2pilkadadki https:\/\/t.co\/tfgiwg0nm0",0,"pilkada dki jakarta harap tidak pilih nomor 2, bahaya laten komunis!...  #debat2pilkadadki ",pilkada dki jakarta harap tidak pilih nomor  bahaya laten komunis  debatpilkadadki ,pilkada dki jakarta harap tidak pilih nomor bahaya laten komunis debatpilkadadki,pilkada dki jakarta harap tidak pilih nomor bahaya laten komunis debatpilkadadki,pilkada dki jakarta harap pilih nomor bahaya laten komunis debatpilkadadki,pilkada dki jakarta harap pilih nomor bahaya laten komunis debatpilkadadki
773,rt @tuansatutiga: surat an-nisa sangat pas dengan kondisi sekarang \n#indonesiabersamaulama #spirit212 #debat2pilkadadki #saveislam \nhttps:\/\u2026,1, surat an-nisa sangat pas dengan kondisi sekarang \n#indonesiabersamaulama #spirit212 #debat2pilkadadki #saveislam \n, surat annisa sangat pas dengan kondisi sekarang nindonesiabersamaulama spirit debatpilkadadki saveislam n,surat annisa sangat pas dengan kondisi sekarang nindonesiabersamaulama spirit debatpilkadadki saveislam n,surat annisa sangat pas dengan kondisi sekarang nindonesiabersamaulama spirit debatpilkadadki saveislam n,surat annisa pas kondisi nindonesiabersamaulama spirit debatpilkadadki saveislam n,surat annisa pas kondisi nindonesiabersamaulama spirit debatpilkadadki saveislam n
774,rt @pandji: ini artikel yg menjelaskan ternyata di #debat2pilkadadki yg dapet respon positif di socmed adalah #aniessandiokoce https:\/\/t.co\u2026,1, ini artikel yg menjelaskan ternyata di #debat2pilkadadki yg dapet respon positif di socmed adalah #aniessandiokoce , ini artikel yg menjelaskan ternyata di debatpilkadadki yg dapet respon positif di socmed adalah aniessandiokoce ,ini artikel yang menjelaskan ternyata di debatpilkadadki yang dapat respon positif di socmed adalah aniessandiokoce,ini artikel yang jelas nyata di debatpilkadadki yang dapat respon positif di socmed adalah aniessandiokoce,artikel nyata debatpilkadadki respon positif socmed aniessandiokoce,artikel debatpilkadadki respon positif socmed aniessandiokoce
775,#debat2pilkadadki yang lain akan menanggulangi banjir   no 2 sudah menghilangkan.banjir,1,#debat2pilkadadki yang lain akan menanggulangi banjir   no 2 sudah menghilangkan.banjir,debatpilkadadki yang lain akan menanggulangi banjir   no  sudah menghilangkanbanjir,debatpilkadadki yang lain akan menanggulangi banjir no sudah menghilangkanbanjir,debatpilkadadki yang lain akan tanggulang banjir no sudah menghilangkanbanjir,debatpilkadadki tanggulang banjir no menghilangkanbanjir,debatpilkadadki menanggulangi banjir no menghilangkanbanjir
776,"rt @teddygusnaidi: 28. kalau gunakan fantasi anies, maka anies bisa menuding bhw ali sadikin bapaknya boy sadikin gak beres memimpin jakart\u2026",0," 28. kalau gunakan fantasi anies, maka anies bisa menuding bhw ali sadikin bapaknya boy sadikin gak beres memimpin jakart\u2026",  kalau gunakan fantasi anies maka anies bisa menuding bhw ali sadikin bapaknya boy sadikin gak beres memimpin jakartu,kalau gunakan fantasi anies maka anies bisa menuding bahwa ali sadikin bapaknya boy sadikin tidak beres memimpin jakartu,kalau guna fantasi anies maka anies bisa tuding bahwa ali sadikin bapak boy sadikin tidak beres pimpin jakartu,fantasi anies anies tuding ali sadikin boy sadikin beres pimpin jakartu,fantasi anies anies menuding ali sadikin bapaknya boy sadikin beres memimpin jakartu
777,"rt @nci4ri: pasca #debat2pilkadadki kena batunya, @agusyudhoyono dibentak kapolres jakarta selatan, karena bikin macet jalan.\nhttps:\/\/t.co\/\u2026",0," pasca #debat2pilkadadki kena batunya,  dibentak kapolres jakarta selatan, karena bikin macet jalan.\n", pasca debatpilkadadki kena batunya  dibentak kapolres jakarta selatan karena bikin macet jalann,pasca debatpilkadadki kena batunya dibentak kapolres jakarta selatan karena bikin macet jalann,pasca debatpilkadadki kena batu bentak kapolres jakarta selatan karena bikin macet jalann,pasca debatpilkadadki kena batu bentak kapolres jakarta selatan bikin macet jalann,pasca debatpilkadadki kena batunya dibentak kapolres jakarta selatan bikin macet jalann
778,pilkada dki jangan pilih pki!! berbahaya!! pilih 1 atau 3 saja pungli di dinas penanama... https:\/\/t.co\/n1ypjew3nq #debat2pilkadadki #imlek,0,pilkada dki jangan pilih pki!! berbahaya!! pilih 1 atau 3 saja pungli di dinas penanama...  #debat2pilkadadki #imlek,pilkada dki jangan pilih pki berbahaya pilih  atau  saja pungli di dinas penanama  debatpilkadadki imlek,pilkada dki jangan pilih pki berbahaya pilih atau saja pungli di dinas penanama debatpilkadadki imlek,pilkada dki jangan pilih pki bahaya pilih atau saja pungli di dinas penanama debatpilkadadki imlek,pilkada dki pilih pki bahaya pilih pungli dinas penanama debatpilkadadki imlek,pilkada dki pilih pki berbahaya pilih pungli dinas penanama debatpilkadadki imlek
779,"rt @gitamontolalu: kami ingin melayani karena \""rakyat adalah boss kami\"" #ahokdjarot #basukidjarot #debat2pilkadadki pls rt\u2026 ",1," kami ingin melayani karena \""rakyat adalah boss kami\"" #ahokdjarot #basukidjarot #debat2pilkadadki pls rt\u2026 ", kami ingin melayani karena rakyat adalah boss kami ahokdjarot basukidjarot debatpilkadadki pls rtu ,kami ingin melayani karena rakyat adalah bos kami ahokdjarot basukidjarot debatpilkadadki pls rtu,kami ingin layan karena rakyat adalah bos kami ahokdjarot basukidjarot debatpilkadadki pls rtu,layan rakyat bos ahokdjarot basukidjarot debatpilkadadki pls rtu,melayani rakyat bos ahokdjarot basukidjarot debatpilkadadki pls rtu
780,"#debat2pilkadadki\nsemonga masyarakat indonesia tidak salah memilih pemimpin,,\nsaya mendukung pak anies...\nsemangaat @prabowo",1,"#debat2pilkadadki\nsemonga masyarakat indonesia tidak salah memilih pemimpin,,\nsaya mendukung pak anies...\nsemangaat ",debatpilkadadkinsemonga masyarakat indonesia tidak salah memilih pemimpinnsaya mendukung pak aniesnsemangaat ,debatpilkadadkinsemonga masyarakat indonesia tidak salah memilih pemimpinnsaya mendukung pak aniesnsemangaat,debatpilkadadkinsemonga masyarakat indonesia tidak salah pilih pemimpinnsaya dukung pak aniesnsemangaat,debatpilkadadkinsemonga masyarakat indonesia salah pilih pemimpinnsaya dukung aniesnsemangaat,debatpilkadadkinsemonga masyarakat indonesia salah memilih pemimpinnsaya mendukung aniesnsemangaat
781,"#debat2pilkadadki\nsemonga masyarakat indonesia tidak salah memilih pemimpin,,\nsaya mendukung pak anies...\nsemangaat @prabowo",1,"#debat2pilkadadki\nsemonga masyarakat indonesia tidak salah memilih pemimpin,,\nsaya mendukung pak anies...\nsemangaat ",debatpilkadadkinsemonga masyarakat indonesia tidak salah memilih pemimpinnsaya mendukung pak aniesnsemangaat ,debatpilkadadkinsemonga masyarakat indonesia tidak salah memilih pemimpinnsaya mendukung pak aniesnsemangaat,debatpilkadadkinsemonga masyarakat indonesia tidak salah pilih pemimpinnsaya dukung pak aniesnsemangaat,debatpilkadadkinsemonga masyarakat indonesia salah pilih pemimpinnsaya dukung aniesnsemangaat,debatpilkadadkinsemonga masyarakat indonesia salah memilih pemimpinnsaya mendukung aniesnsemangaat
782,rt @rey231213: #debat2pilkadadki    akhirnya kita tahu maksud pak jokowi https:\/\/t.co\/enekh8hwhy,1, #debat2pilkadadki    akhirnya kita tahu maksud pak jokowi , debatpilkadadki    akhirnya kita tahu maksud pak jokowi ,debatpilkadadki akhirnya kita tahu maksud pak jokowi,debatpilkadadki akhir kita tahu maksud pak jokowi,debatpilkadadki maksud jokowi,debatpilkadadki maksud jokowi
783,"rt @ilie64188831: #debat2pilkadadki\npaslon 1, makin wibawa, \npaslon 2, makin lucu, bingung jawab serangan paslon 3\npaslon 3, makin garang d\u2026",1," #debat2pilkadadki\npaslon 1, makin wibawa, \npaslon 2, makin lucu, bingung jawab serangan paslon 3\npaslon 3, makin garang d\u2026", debatpilkadadkinpaslon  makin wibawa npaslon  makin lucu bingung jawab serangan paslon npaslon  makin garang du,debatpilkadadkinpaslon makin wibawa npaslon makin lucu bingung jawab serangan paslon npaslon makin garang du,debatpilkadadkinpaslon makin wibawa npaslon makin lucu bingung jawab serang paslon npaslon makin garang du,debatpilkadadkinpaslon wibawa npaslon lucu bingung serang paslon npaslon garang du,debatpilkadadkinpaslon wibawa npaslon lucu bingung serangan paslon npaslon garang du
784,rt @sohibahy: setelah debat makin mantap dengan mas @agusyudhoyono dan mpok @sylviana_murni yaa pak \ud83d\ude0a https:\/\/t.co\/6fs8lhlvge,1, setelah debat makin mantap dengan mas  dan mpok  yaa pak \ud83d\ude0a , setelah debat makin mantap dengan mas  dan mpok  yaa pak uddudea ,setelah debat makin mantap dengan mas dan mpok ya pak uddudea,telah debat makin mantap dengan mas dan mpok ya pak uddudea,debat mantap mas mpok ya uddudea,debat mantap mas mpok ya uddudea
785,rt @ych7168: dari awal kampanye  @aniesbaswedan @sandiuno  kan sudah biasa salah data mulu dan ga perlu kaget kalo over budget 2\u2026 ,0, dari awal kampanye     kan sudah biasa salah data mulu dan ga perlu kaget kalo over budget 2\u2026 , dari awal kampanye     kan sudah biasa salah data mulu dan ga perlu kaget kalo over budget u ,dari awal kampanye kan sudah biasa salah data mulu dan tidak perlu kaget kalo over budget kamu,dari awal kampanye kan sudah biasa salah data mulu dan tidak perlu kaget kalo over budget kamu,kampanye salah data mulu kaget kalo over budget,kampanye salah data mulu kaget kalo over budget
786,rt @andreobz: di tinggal ahok cuti jakarta semakin kacauuuu....parahhhh https:\/\/t.co\/cugf9lsdnd #debat2pilkadadki,0, di tinggal ahok cuti jakarta semakin kacauuuu....parahhhh  #debat2pilkadadki, di tinggal ahok cuti jakarta semakin kacauuuuparahhhh  debatpilkadadki,di tinggal ahok cuti jakarta semakin kacauuparahh debatpilkadadki,di tinggal ahok cuti jakarta makin kacauuparahh debatpilkadadki,tinggal ahok cuti jakarta kacauuparahh debatpilkadadki,tinggal ahok cuti jakarta kacauuparahh debatpilkadadki
787,"rt @teddygusnaidi: 28. kalau gunakan fantasi anies, maka anies bisa menuding bhw ali sadikin bapaknya boy sadikin gak beres memimpin jakart\u2026",0," 28. kalau gunakan fantasi anies, maka anies bisa menuding bhw ali sadikin bapaknya boy sadikin gak beres memimpin jakart\u2026",  kalau gunakan fantasi anies maka anies bisa menuding bhw ali sadikin bapaknya boy sadikin gak beres memimpin jakartu,kalau gunakan fantasi anies maka anies bisa menuding bahwa ali sadikin bapaknya boy sadikin tidak beres memimpin jakartu,kalau guna fantasi anies maka anies bisa tuding bahwa ali sadikin bapak boy sadikin tidak beres pimpin jakartu,fantasi anies anies tuding ali sadikin boy sadikin beres pimpin jakartu,fantasi anies anies menuding ali sadikin bapaknya boy sadikin beres memimpin jakartu
788,rt @iqlimas: bergelar ph.d anies baswedan tidak malu menyerang dgn data abal2  #debat2pilkadadki https:\/\/t.co\/igjzl4bszm,1, bergelar ph.d anies baswedan tidak malu menyerang dgn data abal2  #debat2pilkadadki , bergelar phd anies baswedan tidak malu menyerang dgn data abal  debatpilkadadki ,bergelar phd anies baswedan tidak malu menyerang dengan data abal debatpilkadadki,gelar phd anies baswedan tidak malu serang dengan data abal debatpilkadadki,gelar phd anies baswedan malu serang data abal debatpilkadadki,bergelar phd anies baswedan malu menyerang data abal debatpilkadadki
